front,back,unidad,materia,submateria,tipo,nivel
¿Cuál es la función del derecho objetivo en la relación jurídica? (Variante 1),Actúa como regla que determina el nacimiento y límites de facultades y deberes.,DERECHO_CIVIL_1,RELACION_JURIDICA_Y_DERECHOS_SUBJETIVOS,RELACION_JURIDICA,CIVIL,INTERMEDIO
¿En qué se diferencia el deber jurídico de la obligación? (Variante 1),"Obligación es especie de deber, con contenido patrimonial y sujetos determinados.",DERECHO_CIVIL_1,RELACION_JURIDICA_Y_DERECHOS_SUBJETIVOS,RELACION_JURIDICA,CIVIL,INTERMEDIO
¿Qué es el interés en la relación jurídica? (Variante 1),Es el móvil que justifica la protección del derecho y la imposición del deber.,DERECHO_CIVIL_1,RELACION_JURIDICA_Y_DERECHOS_SUBJETIVOS,RELACION_JURIDICA,CIVIL,INTERMEDIO
Diferencia entre relación jurídica y relación social. (Variante 1),La jurídica está tipificada por la ley; la social por la moral o trato.,DERECHO_CIVIL_1,RELACION_JURIDICA_Y_DERECHOS_SUBJETIVOS,RELACION_JURIDICA,CIVIL,INTERMEDIO
¿Qué es el efecto expansivo de la relación jurídica? (Variante 1),Deber de terceros de reconocer y respetar la existencia de un vínculo ajeno.,DERECHO_CIVIL_1,RELACION_JURIDICA_Y_DERECHOS_SUBJETIVOS,RELACION_JURIDICA,CIVIL,INTERMEDIO
¿Cómo critica Kelsen la distinción objetivo/subjetivo? (Variante 1),Afirma que el derecho subjetivo es solo el objetivo a disposición de un sujeto.,DERECHO_CIVIL_1,RELACION_JURIDICA_Y_DERECHOS_SUBJETIVOS,RELACION_JURIDICA,CIVIL,AVANZADO
Relación entre autonomía privada y la relación jurídica. (Variante 1),La voluntad es la fuente principal para crear el contenido de relaciones de tráfico.,DERECHO_CIVIL_1,RELACION_JURIDICA_Y_DERECHOS_SUBJETIVOS,RELACION_JURIDICA,CIVIL,AVANZADO
¿Cómo opera la relación jurídica en derechos de la personalidad? (Variante 1),"Sujeto activo titular, pasivo la colectividad obligada al respeto (erga omnes).",DERECHO_CIVIL_1,RELACION_JURIDICA_Y_DERECHOS_SUBJETIVOS,RELACION_JURIDICA,CIVIL,AVANZADO
Análisis de la relación jurídica en la teoría de actos propios. (Variante 1),Impide alterar relaciones consolidadas mediante conductas contradictorias previas.,DERECHO_CIVIL_1,RELACION_JURIDICA_Y_DERECHOS_SUBJETIVOS,RELACION_JURIDICA,CIVIL,AVANZADO
Análisis de la desaparición del vínculo en la extinción. (Variante 1),"Ocurre cuando el interés se satisface o el objeto desaparece, rompiendo el nexo.",DERECHO_CIVIL_1,RELACION_JURIDICA_Y_DERECHOS_SUBJETIVOS,RELACION_JURIDICA,CIVIL,AVANZADO
Crítica de Duguit al concepto de relación jurídica. (Variante 1),"La niega, prefiriendo el concepto de función social y solidaridad.",DERECHO_CIVIL_1,RELACION_JURIDICA_Y_DERECHOS_SUBJETIVOS,RELACION_JURIDICA,CIVIL,AVANZADO
¿Qué es el nacimiento de un derecho?,Unión de facultad a un sujeto por cumplirse presupuestos legales.,DERECHO_CIVIL_1,RELACION_JURIDICA_Y_DERECHOS_SUBJETIVOS,DINAMICA_DERECHOS,CIVIL,BASICO
¿Qué es la adquisición originaria?,Se produce sin derivar de titular anterior (ej. ocupación).,DERECHO_CIVIL_1,RELACION_JURIDICA_Y_DERECHOS_SUBJETIVOS,DINAMICA_DERECHOS,CIVIL,BASICO
¿Qué es la adquisición derivativa?,Derecho se traspasa de un titular a otro (ej. compraventa).,DERECHO_CIVIL_1,RELACION_JURIDICA_Y_DERECHOS_SUBJETIVOS,DINAMICA_DERECHOS,CIVIL,BASICO
¿Qué es la modificación de un derecho?,Cambios en sujetos u objeto sin llegar a extinguirse.,DERECHO_CIVIL_1,RELACION_JURIDICA_Y_DERECHOS_SUBJETIVOS,DINAMICA_DERECHOS,CIVIL,BASICO
¿Qué es la extinción de un derecho?,Desaparición absoluta del derecho del mundo jurídico.,DERECHO_CIVIL_1,RELACION_JURIDICA_Y_DERECHOS_SUBJETIVOS,DINAMICA_DERECHOS,CIVIL,BASICO
¿Qué es la pérdida de un derecho?,"Separación del derecho de su titular, subsistiendo en otro.",DERECHO_CIVIL_1,RELACION_JURIDICA_Y_DERECHOS_SUBJETIVOS,DINAMICA_DERECHOS,CIVIL,BASICO
¿Qué es la tradición?,Modo derivativo: entrega con intención de transferir dominio.,DERECHO_CIVIL_1,RELACION_JURIDICA_Y_DERECHOS_SUBJETIVOS,DINAMICA_DERECHOS,CIVIL,BASICO
¿Qué es la prescripción adquisitiva?,Modo originario por poseer durante tiempo legal.,DERECHO_CIVIL_1,RELACION_JURIDICA_Y_DERECHOS_SUBJETIVOS,DINAMICA_DERECHOS,CIVIL,BASICO
Nacimiento vs Adquisición.,Nacimiento es creación ex novo; Adquisición incorporación al patrimonio.,DERECHO_CIVIL_1,RELACION_JURIDICA_Y_DERECHOS_SUBJETIVOS,DINAMICA_DERECHOS,CIVIL,INTERMEDIO
Originaria vs Derivativa.,Originaria nace limpio; Derivativa recibe cargas y vicios.,DERECHO_CIVIL_1,RELACION_JURIDICA_Y_DERECHOS_SUBJETIVOS,DINAMICA_DERECHOS,CIVIL,INTERMEDIO
Modificación subjetiva vs objetiva.,Subjetiva: cambio titular; Objetiva: cambio prestación/objeto.,DERECHO_CIVIL_1,RELACION_JURIDICA_Y_DERECHOS_SUBJETIVOS,DINAMICA_DERECHOS,CIVIL,INTERMEDIO
Extinción vs Pérdida.,Extinción es fin absoluto; Pérdida es cambio de titular.,DERECHO_CIVIL_1,RELACION_JURIDICA_Y_DERECHOS_SUBJETIVOS,DINAMICA_DERECHOS,CIVIL,INTERMEDIO
Regla 'nemo plus iuris'.,Nadie transfiere más derechos de los que tiene.,DERECHO_CIVIL_1,RELACION_JURIDICA_Y_DERECHOS_SUBJETIVOS,DINAMICA_DERECHOS,CIVIL,INTERMEDIO
Ley como fuente directa.,Derecho nace por solo ministerio de la ley (ej. usufructo legal).,DERECHO_CIVIL_1,RELACION_JURIDICA_Y_DERECHOS_SUBJETIVOS,DINAMICA_DERECHOS,CIVIL,INTERMEDIO
Subrogación real vs personal.,Real: cosa por cosa; Personal: persona por persona en vínculo.,DERECHO_CIVIL_1,RELACION_JURIDICA_Y_DERECHOS_SUBJETIVOS,DINAMICA_DERECHOS,CIVIL,INTERMEDIO
Error en el título en adquisición derivativa.,"Si título es nulo, no hay adquisición (falta causa, Art. 675).",DERECHO_CIVIL_1,RELACION_JURIDICA_Y_DERECHOS_SUBJETIVOS,DINAMICA_DERECHOS,CIVIL,AVANZADO
Teoría de apariencia en adquisición.,Adquisición de no dueño bajo error común y buena fe.,DERECHO_CIVIL_1,RELACION_JURIDICA_Y_DERECHOS_SUBJETIVOS,DINAMICA_DERECHOS,CIVIL,AVANZADO
Título y modo en derecho chileno.,Requiere causa (contrato) y mecanismo ejecución (tradición).,DERECHO_CIVIL_1,RELACION_JURIDICA_Y_DERECHOS_SUBJETIVOS,DINAMICA_DERECHOS,CIVIL,AVANZADO
Resolución del derecho del constituyente.,Extinción dominio original extingue derechos reales limitados.,DERECHO_CIVIL_1,RELACION_JURIDICA_Y_DERECHOS_SUBJETIVOS,DINAMICA_DERECHOS,CIVIL,AVANZADO
Renuncia y orden público económico.,Prohibición de renunciar derechos irrenunciables (ej. laborales).,DERECHO_CIVIL_1,RELACION_JURIDICA_Y_DERECHOS_SUBJETIVOS,DINAMICA_DERECHOS,CIVIL,AVANZADO
¿Qué es el nacimiento de un derecho? (Variante 1),Unión de facultad a un sujeto por cumplirse presupuestos legales.,DERECHO_CIVIL_1,RELACION_JURIDICA_Y_DERECHOS_SUBJETIVOS,DINAMICA_DERECHOS,CIVIL,BASICO
¿Qué es la adquisición originaria? (Variante 1),Se produce sin derivar de titular anterior (ej. ocupación).,DERECHO_CIVIL_1,RELACION_JURIDICA_Y_DERECHOS_SUBJETIVOS,DINAMICA_DERECHOS,CIVIL,BASICO
¿Qué es la adquisición derivativa? (Variante 1),Derecho se traspasa de un titular a otro (ej. compraventa).,DERECHO_CIVIL_1,RELACION_JURIDICA_Y_DERECHOS_SUBJETIVOS,DINAMICA_DERECHOS,CIVIL,BASICO
¿Qué es la modificación de un derecho? (Variante 1),Cambios en sujetos u objeto sin llegar a extinguirse.,DERECHO_CIVIL_1,RELACION_JURIDICA_Y_DERECHOS_SUBJETIVOS,DINAMICA_DERECHOS,CIVIL,BASICO
¿Qué es la extinción de un derecho? (Variante 1),Desaparición absoluta del derecho del mundo jurídico.,DERECHO_CIVIL_1,RELACION_JURIDICA_Y_DERECHOS_SUBJETIVOS,DINAMICA_DERECHOS,CIVIL,BASICO
¿Qué es la pérdida de un derecho? (Variante 1),"Separación del derecho de su titular, subsistiendo en otro.",DERECHO_CIVIL_1,RELACION_JURIDICA_Y_DERECHOS_SUBJETIVOS,DINAMICA_DERECHOS,CIVIL,BASICO
¿Qué es la tradición? (Variante 1),Modo derivativo: entrega con intención de transferir dominio.,DERECHO_CIVIL_1,RELACION_JURIDICA_Y_DERECHOS_SUBJETIVOS,DINAMICA_DERECHOS,CIVIL,BASICO
¿Qué es la prescripción adquisitiva? (Variante 1),Modo originario por poseer durante tiempo legal.,DERECHO_CIVIL_1,RELACION_JURIDICA_Y_DERECHOS_SUBJETIVOS,DINAMICA_DERECHOS,CIVIL,BASICO
Nacimiento vs Adquisición. (Variante 1),Nacimiento es creación ex novo; Adquisición incorporación al patrimonio.,DERECHO_CIVIL_1,RELACION_JURIDICA_Y_DERECHOS_SUBJETIVOS,DINAMICA_DERECHOS,CIVIL,INTERMEDIO
Originaria vs Derivativa. (Variante 1),Originaria nace limpio; Derivativa recibe cargas y vicios.,DERECHO_CIVIL_1,RELACION_JURIDICA_Y_DERECHOS_SUBJETIVOS,DINAMICA_DERECHOS,CIVIL,INTERMEDIO
Modificación subjetiva vs objetiva. (Variante 1),Subjetiva: cambio titular; Objetiva: cambio prestación/objeto.,DERECHO_CIVIL_1,RELACION_JURIDICA_Y_DERECHOS_SUBJETIVOS,DINAMICA_DERECHOS,CIVIL,INTERMEDIO
Extinción vs Pérdida. (Variante 1),Extinción es fin absoluto; Pérdida es cambio de titular.,DERECHO_CIVIL_1,RELACION_JURIDICA_Y_DERECHOS_SUBJETIVOS,DINAMICA_DERECHOS,CIVIL,INTERMEDIO
Regla 'nemo plus iuris'. (Variante 1),Nadie transfiere más derechos de los que tiene.,DERECHO_CIVIL_1,RELACION_JURIDICA_Y_DERECHOS_SUBJETIVOS,DINAMICA_DERECHOS,CIVIL,INTERMEDIO
Ley como fuente directa. (Variante 1),Derecho nace por solo ministerio de la ley (ej. usufructo legal).,DERECHO_CIVIL_1,RELACION_JURIDICA_Y_DERECHOS_SUBJETIVOS,DINAMICA_DERECHOS,CIVIL,INTERMEDIO
Subrogación real vs personal. (Variante 1),Real: cosa por cosa; Personal: persona por persona en vínculo.,DERECHO_CIVIL_1,RELACION_JURIDICA_Y_DERECHOS_SUBJETIVOS,DINAMICA_DERECHOS,CIVIL,INTERMEDIO
Error en el título en adquisición derivativa. (Variante 1),"Si título es nulo, no hay adquisición (falta causa, Art. 675).",DERECHO_CIVIL_1,RELACION_JURIDICA_Y_DERECHOS_SUBJETIVOS,DINAMICA_DERECHOS,CIVIL,AVANZADO
Teoría de apariencia en adquisición. (Variante 1),Adquisición de no dueño bajo error común y buena fe.,DERECHO_CIVIL_1,RELACION_JURIDICA_Y_DERECHOS_SUBJETIVOS,DINAMICA_DERECHOS,CIVIL,AVANZADO
Título y modo en derecho chileno. (Variante 1),Requiere causa (contrato) y mecanismo ejecución (tradición).,DERECHO_CIVIL_1,RELACION_JURIDICA_Y_DERECHOS_SUBJETIVOS,DINAMICA_DERECHOS,CIVIL,AVANZADO
Resolución del derecho del constituyente. (Variante 1),Extinción dominio original extingue derechos reales limitados.,DERECHO_CIVIL_1,RELACION_JURIDICA_Y_DERECHOS_SUBJETIVOS,DINAMICA_DERECHOS,CIVIL,AVANZADO
Renuncia y orden público económico. (Variante 1),Prohibición de renunciar derechos irrenunciables (ej. laborales).,DERECHO_CIVIL_1,RELACION_JURIDICA_Y_DERECHOS_SUBJETIVOS,DINAMICA_DERECHOS,CIVIL,AVANZADO
