titulo,textoCompleto,rama,libro,titulo_materia,materia,dificultad
"Art. 434 Nº 1-2 CPC — Títulos ejecutivos","El juicio ejecutivo tiene lugar en las obligaciones de dar cuanto se pide compulsivamente el cumplimiento de una obligación que consta en un título que tenga aparejada ejecución. Son títulos ejecutivos: sentencia firme, bien sea definitiva o interlocutoria; copia autorizada de escritura pública.",DERECHO_PROCESAL_CIVIL,LIBRO_III,TITULO_I,Del juicio ejecutivo,1
"Art. 435 CPC — Reconocimiento de firma","Si en caso de no tener el acreedor título ejecutivo, quiere preparar la ejecución por el reconocimiento de firma o por la confesión de la deuda, podrá pedir que se cite al deudor a la presencia judicial a fin de que practique la que corresponda de esas diligencias.",DERECHO_PROCESAL_CIVIL,LIBRO_III,TITULO_I,Del juicio ejecutivo,2
"Art. 443 CPC — Mandamiento de ejecución y embargo","El mandamiento de ejecución contendrá: la orden de requerir de pago al deudor; la de embargarle bienes suficientes para cubrir la deuda con sus intereses y las costas, si no paga en el acto; y la designación de un depositario provisional.",DERECHO_PROCESAL_CIVIL,LIBRO_III,TITULO_I,Del juicio ejecutivo,1
"Art. 464 encabezado CPC — Excepciones","La oposición del ejecutado solo será admisible cuando se funde en alguna de las excepciones siguientes.",DERECHO_PROCESAL_CIVIL,LIBRO_III,TITULO_I,Del juicio ejecutivo,1
"Art. 472 CPC — Sin excepciones","Si no se oponen excepciones, se omitirá la sentencia y bastará el mandamiento de ejecución para que el acreedor pueda perseguir la realización de los bienes embargados.",DERECHO_PROCESAL_CIVIL,LIBRO_III,TITULO_I,Del juicio ejecutivo,2
