titulo,columnaIzqLabel,columnaDerLabel,pares_json,explicacion,rama,libro,titulo_materia,materia,dificultad
"Cuatro clases de resoluciones judiciales","Resolución","Definición","[{""id"":1,""izquierda"":""Sentencia definitiva"",""derecha"":""Pone fin a la instancia resolviendo el fondo del asunto""},{""id"":2,""izquierda"":""Sentencia interlocutoria"",""derecha"":""Falla incidente con derechos permanentes o resuelve trámite base para otra sentencia""},{""id"":3,""izquierda"":""Auto"",""derecha"":""Falla incidente sin establecer derechos permanentes""},{""id"":4,""izquierda"":""Decreto"",""derecha"":""Solo arregla la substanciación del proceso (trámite)""}]","Art. 158 CPC. Cuadro esencial de clasificación de resoluciones.",DERECHO_PROCESAL_CIVIL,LIBRO_I,TITULO_XVII,De las resoluciones judiciales,1
"Efectos de las resoluciones según su tipo","Efecto","Qué resoluciones lo producen","[{""id"":1,""izquierda"":""Desasimiento del tribunal"",""derecha"":""Solo sentencias definitivas e interlocutorias notificadas (art. 182)""},{""id"":2,""izquierda"":""Cosa juzgada"",""derecha"":""Solo sentencias definitivas e interlocutorias firmes (art. 175)""},{""id"":3,""izquierda"":""Modificables por reposición"",""derecha"":""Autos y decretos (art. 181)""}]","Arts. 175, 181, 182 CPC. Los efectos dependen del tipo de resolución.",DERECHO_PROCESAL_CIVIL,LIBRO_I,TITULO_XVII,De las resoluciones judiciales,2
"Acción vs. Excepción de cosa juzgada","Aspecto","Acción / Excepción","[{""id"":1,""izquierda"":""Finalidad"",""derecha"":""Acción: ejecutar lo resuelto | Excepción: impedir nuevo juicio sobre lo mismo""},{""id"":2,""izquierda"":""Quién puede alegarla"",""derecha"":""Acción: solo el que obtuvo (ganó) | Excepción: cualquiera de las partes""},{""id"":3,""izquierda"":""Fundamento normativo"",""derecha"":""Acción: art. 176 CPC | Excepción: art. 177 CPC""},{""id"":4,""izquierda"":""Requisitos"",""derecha"":""Acción: sentencia favorable firme | Excepción: triple identidad (personas, cosa pedida, causa de pedir)""}]","Arts. 176-177 CPC. Comparación esencial entre las dos manifestaciones de la cosa juzgada.",DERECHO_PROCESAL_CIVIL,LIBRO_I,TITULO_XVII,De las resoluciones judiciales,2
"Cosa juzgada formal vs. material","Tipo","Efecto","[{""id"":1,""izquierda"":""Formal"",""derecha"":""Inimpugnabilidad dentro del mismo proceso; puede revisarse en juicio posterior""},{""id"":2,""izquierda"":""Material"",""derecha"":""Inmutabilidad absoluta; no puede discutirse en ningún juicio posterior""}]","Doctrina procesal. La material es la verdadera cosa juzgada; la formal es solo preclusión intraprocesal.",DERECHO_PROCESAL_CIVIL,LIBRO_I,TITULO_XVII,De las resoluciones judiciales,3
"Sentencia firme vs. Sentencia que causa ejecutoria","Estado","Definición","[{""id"":1,""izquierda"":""Firme o ejecutoriada"",""derecha"":""No admite recurso alguno: inmodificable (art. 174 CPC)""},{""id"":2,""izquierda"":""Que causa ejecutoria"",""derecha"":""Puede cumplirse pese a recursos pendientes concedidos en solo efecto devolutivo""}]","Art. 174 CPC y doctrina. La firme es definitiva; la que causa ejecutoria es provisional pero cumplible.",DERECHO_PROCESAL_CIVIL,LIBRO_I,TITULO_XVII,De las resoluciones judiciales,2
