textoConErrores,textoOriginal,errores_json,totalErrores,explicacion,rama,libro,titulo,materia,dificultad
"La ley es una declaración de la voluntad popular que, manifestada en la forma prescrita por el Congreso, manda, prohíbe o permite.","La ley es una declaración de la voluntad soberana que, manifestada en la forma prescrita por la Constitución, manda, prohíbe o permite.","[{""id"":1,""textoIncorrecto"":""popular"",""textoCorrecto"":""soberana"",""explicacion"":""El art. 1 CC usa 'voluntad soberana', no 'voluntad popular'. La soberanía reside en la nación, no en el pueblo directamente.""},{""id"":2,""textoIncorrecto"":""el Congreso"",""textoCorrecto"":""la Constitución"",""explicacion"":""La forma de la ley la prescribe la Constitución (proceso legislativo constitucional), no el Congreso por sí solo.""}]",2,"Art. 1 CC. Dos errores en la definición legal de ley.",DERECHO_CIVIL,TITULO_PRELIMINAR,TITULO_I,De la Ley,1
"La costumbre constituye derecho en todos los casos, según el artículo 2 del Código Civil.","La costumbre no constituye derecho sino en los casos en que la ley se remite a ella, según el artículo 2 del Código Civil.","[{""id"":1,""textoIncorrecto"":""constituye derecho en todos los casos"",""textoCorrecto"":""no constituye derecho sino en los casos en que la ley se remite a ella"",""explicacion"":""El art. 2 CC restringe la costumbre como fuente formal: solo vale cuando la ley se remite a ella (sistema secundum legem).""}]",1,"Art. 2 CC. Error fundamental sobre el alcance de la costumbre en el derecho civil chileno.",DERECHO_CIVIL,TITULO_PRELIMINAR,TITULO_I,De la Ley,1
"La ley obliga desde su aprobación por el Congreso Nacional. La publicación se hará en cualquier diario de circulación nacional, y desde entonces será obligatoria.","La ley no obliga sino una vez promulgada y publicada. La publicación se hará mediante su inserción en el Diario Oficial, y desde la fecha de éste se entenderá conocida de todos y será obligatoria.","[{""id"":1,""textoIncorrecto"":""desde su aprobación por el Congreso Nacional"",""textoCorrecto"":""una vez promulgada en conformidad a la Constitución Política y publicada"",""explicacion"":""Arts. 6-7 CC: se requieren dos actos posteriores a la aprobación: promulgación y publicación.""},{""id"":2,""textoIncorrecto"":""cualquier diario de circulación nacional"",""textoCorrecto"":""el Diario Oficial"",""explicacion"":""Art. 7 CC: el medio exclusivo de publicación es el Diario Oficial, no cualquier diario.""}]",2,"Arts. 6 y 7 CC. Confusión entre aprobación, promulgación y publicación.",DERECHO_CIVIL,TITULO_PRELIMINAR,TITULO_II,Promulgación de la Ley,2
"La ley puede disponer para el futuro y excepcionalmente tendrá efecto retroactivo cuando así lo declare el Presidente de la República.","La ley puede solo disponer para lo futuro, y no tendrá jamás efecto retroactivo.","[{""id"":1,""textoIncorrecto"":""excepcionalmente tendrá efecto retroactivo cuando así lo declare el Presidente de la República"",""textoCorrecto"":""no tendrá jamás efecto retroactivo"",""explicacion"":""Art. 9 CC es categórico: la ley no tendrá 'jamás' efecto retroactivo. Aunque el legislador (no el Presidente) puede dictar leyes retroactivas, el art. 9 como norma de rango legal lo prohíbe al juez.""}]",1,"Art. 9 CC. El principio de irretroactividad es absoluto a nivel legal.",DERECHO_CIVIL,TITULO_PRELIMINAR,TITULO_III,Efectos de la Ley,2
"Los actos que prohíbe la ley son anulables y producen efectos mientras no sean declarados nulos por sentencia judicial ejecutoriada.","Los actos que prohíbe la ley son nulos y de ningún valor; salvo en cuanto designe expresamente otro efecto que el de nulidad para el caso de contravención.","[{""id"":1,""textoIncorrecto"":""anulables y producen efectos mientras no sean declarados nulos por sentencia judicial ejecutoriada"",""textoCorrecto"":""nulos y de ningún valor"",""explicacion"":""Art. 10 CC: la sanción es nulidad (no anulabilidad). Sin embargo, técnicamente la nulidad requiere declaración judicial, lo cual genera debate doctrinario entre nulidad ab initio e inexistencia.""}]",1,"Art. 10 CC. Distinción entre nulidad y anulabilidad.",DERECHO_CIVIL,TITULO_PRELIMINAR,TITULO_III,Efectos de la Ley,2
"Cuando el sentido de la ley es claro, el juez debe consultar su espíritu manifestado en la historia fidedigna de su establecimiento para determinar su alcance.","Cuando el sentido de la ley es claro, no se desatenderá su tenor literal, a pretexto de consultar su espíritu.","[{""id"":1,""textoIncorrecto"":""el juez debe consultar su espíritu manifestado en la historia fidedigna de su establecimiento para determinar su alcance"",""textoCorrecto"":""no se desatenderá su tenor literal, a pretexto de consultar su espíritu"",""explicacion"":""Art. 19 inc. 1 CC: si el sentido es claro, prevalece el tenor literal. Solo cuando es oscuro se recurre al espíritu y la historia fidedigna (inc. 2).""}]",1,"Art. 19 CC. El elemento gramatical prevalece cuando el texto es claro.",DERECHO_CIVIL,TITULO_PRELIMINAR,TITULO_IV,Interpretación de la Ley,2
"Se llama dolo la negligencia grave en el manejo de los negocios ajenos. La culpa grave consiste en la intención positiva de inferir injuria a la persona o propiedad de otro.","Se llama dolo la intención positiva de inferir injuria a la persona o propiedad de otro. La culpa grave consiste en no manejar los negocios ajenos con aquel cuidado que aun las personas negligentes y de poca prudencia suelen emplear.","[{""id"":1,""textoIncorrecto"":""Se llama dolo la negligencia grave en el manejo de los negocios ajenos"",""textoCorrecto"":""Se llama dolo la intención positiva de inferir injuria a la persona o propiedad de otro"",""explicacion"":""Art. 44 CC: el dolo es intención (no negligencia). La definición del texto erróneo corresponde más bien a la culpa grave.""},{""id"":2,""textoIncorrecto"":""La culpa grave consiste en la intención positiva de inferir injuria a la persona o propiedad de otro"",""textoCorrecto"":""La culpa grave consiste en no manejar los negocios ajenos con aquel cuidado que aun las personas negligentes emplean"",""explicacion"":""Las definiciones están invertidas: se atribuyó a cada concepto la definición del otro.""}]",2,"Art. 44 CC. Confusión entre dolo y culpa grave (definiciones invertidas).",DERECHO_CIVIL,TITULO_PRELIMINAR,TITULO_V,Definición de varias palabras de uso frecuente,1
"La derogación tácita deroga íntegramente la ley anterior cuando la nueva ley versa sobre la misma materia, según el artículo 53 del Código Civil.","La derogación tácita deja vigente en las leyes anteriores, aunque versen sobre la misma materia, todo aquello que no pugna con las disposiciones de la nueva ley.","[{""id"":1,""textoIncorrecto"":""deroga íntegramente la ley anterior cuando la nueva ley versa sobre la misma materia"",""textoCorrecto"":""deja vigente en las leyes anteriores todo aquello que no pugna con las disposiciones de la nueva ley, aunque versen sobre la misma materia"",""explicacion"":""Art. 53 CC: la derogación tácita es siempre parcial. Solo quedan sin efecto las normas incompatibles, no toda la ley anterior.""}]",1,"Art. 53 CC. Error común: la derogación tácita NO es total aunque las leyes versen sobre la misma materia.",DERECHO_CIVIL,TITULO_PRELIMINAR,TITULO_VI,Derogación de las Leyes,2
