textoConErrores,textoOriginal,errores_json,totalErrores,explicacion,rama,libro,titulo,materia,dificultad
"La fianza es una caución real que recae sobre un bien específico del fiador. Es irrenunciable el beneficio de excusión.","La fianza es una caución PERSONAL (el fiador responde con todo su patrimonio). El beneficio de excusión es renunciable.","[{""id"":1,""textoIncorrecto"":""caución real que recae sobre un bien específico"",""textoCorrecto"":""caución personal: el fiador responde con todo su patrimonio"",""explicacion"":""La fianza es personal, no real. Las reales son prenda e hipoteca.""},{""id"":2,""textoIncorrecto"":""Es irrenunciable el beneficio de excusión"",""textoCorrecto"":""El beneficio de excusión es renunciable"",""explicacion"":""Art. 2358 CC: el fiador puede renunciar, especialmente si se obliga como fiador y codeudor solidario.""}]",2,"Arts. 2335 y 2358 CC. La fianza es personal y la excusión es renunciable.",DERECHO_CIVIL,LIBRO_IV,TITULO_XXXVI,De la fianza,1
"La prenda civil recae sobre bienes inmuebles y es un contrato consensual. El acreedor prendario tiene preferencia de tercera clase.","La prenda civil recae sobre bienes MUEBLES y es un contrato REAL (requiere entrega). El acreedor prendario tiene preferencia de SEGUNDA clase.","[{""id"":1,""textoIncorrecto"":""bienes inmuebles"",""textoCorrecto"":""bienes muebles"",""explicacion"":""Art. 2384 CC: la prenda recae sobre muebles. Los inmuebles se gravan con hipoteca.""},{""id"":2,""textoIncorrecto"":""contrato consensual"",""textoCorrecto"":""contrato real (se perfecciona por la entrega)"",""explicacion"":""Art. 2386 CC: la prenda es real, no consensual.""},{""id"":3,""textoIncorrecto"":""tercera clase"",""textoCorrecto"":""segunda clase"",""explicacion"":""Art. 2474 CC: la prenda es de 2ª clase. La 3ª es la hipoteca.""}]",3,"Arts. 2384, 2386 y 2474 CC. Tres errores sobre objeto, perfeccionamiento y preferencia de la prenda.",DERECHO_CIVIL,LIBRO_IV,TITULO_XXXVII,Del contrato de prenda,1
"La hipoteca se constituye por documento privado sin necesidad de inscripción. El inmueble hipotecado debe entregarse al acreedor hipotecario.","La hipoteca se constituye por escritura pública con inscripción en el CBR. El inmueble permanece en poder del deudor (sin desplazamiento).","[{""id"":1,""textoIncorrecto"":""documento privado sin inscripción"",""textoCorrecto"":""escritura pública + inscripción CBR"",""explicacion"":""Arts. 2409-2410 CC: escritura pública (solemnidad) + inscripción (tradición). Ambas necesarias.""},{""id"":2,""textoIncorrecto"":""debe entregarse al acreedor"",""textoCorrecto"":""permanece en poder del deudor"",""explicacion"":""Art. 2407 CC: la hipoteca es SIN desplazamiento. La prenda civil sí requiere entrega.""}]",2,"Arts. 2407-2410 CC. Confusión sobre formalidades y desplazamiento en la hipoteca.",DERECHO_CIVIL,LIBRO_IV,TITULO_XXXVIII,De la hipoteca,1
"Si el deudor vende el inmueble hipotecado, la hipoteca se extingue automáticamente. El acreedor solo puede cobrar al deudor original.","La venta no extingue la hipoteca: sigue gravando el inmueble. El acreedor puede perseguir el inmueble en manos del comprador (derecho de persecución).","[{""id"":1,""textoIncorrecto"":""la hipoteca se extingue automáticamente"",""textoCorrecto"":""la hipoteca NO se extingue: sigue al inmueble"",""explicacion"":""Art. 2428 CC: derecho de persecución. La hipoteca es derecho real y sigue al bien.""},{""id"":2,""textoIncorrecto"":""solo puede cobrar al deudor original"",""textoCorrecto"":""puede perseguir el inmueble en manos de cualquier poseedor"",""explicacion"":""El acreedor persigue el inmueble contra el tercer poseedor mediante acción de desposeimiento.""}]",2,"Art. 2428 CC. La hipoteca no se extingue por enajenación; el acreedor persigue el bien.",DERECHO_CIVIL,LIBRO_IV,TITULO_XXXVIII,De la hipoteca,2
"La prenda es divisible: si el deudor paga la mitad de la deuda, el acreedor debe devolver la mitad de la cosa prendada. La hipoteca es un derecho personal.","La prenda es INDIVISIBLE: el acreedor retiene toda la cosa hasta el pago total. La hipoteca es un derecho REAL.","[{""id"":1,""textoIncorrecto"":""La prenda es divisible"",""textoCorrecto"":""La prenda es indivisible"",""explicacion"":""Art. 2405 CC: toda la prenda garantiza toda la deuda. No hay restitución parcial.""},{""id"":2,""textoIncorrecto"":""La hipoteca es un derecho personal"",""textoCorrecto"":""La hipoteca es un derecho real"",""explicacion"":""Art. 577 CC: la hipoteca está enumerada como derecho real. Grava el inmueble, no la persona.""}]",2,"Arts. 577 y 2405 CC. Indivisibilidad de la prenda y naturaleza real de la hipoteca.",DERECHO_CIVIL,LIBRO_IV,TITULO_XXXVII,Del contrato de prenda,2
