titulo,textoCompleto,rama,libro,titulo_materia,materia,dificultad
"Art. 951 CC — Sucesión a título universal y singular","Se sucede a una persona difunta a título universal o a título singular. El título es universal cuando se sucede al difunto en todos sus bienes, derechos y obligaciones transmisibles, o en una cuota de ellos, como la mitad, tercio o quinto. El título es singular cuando se sucede en una o más especies o cuerpos ciertos.",DERECHO_CIVIL,LIBRO_III,TITULO_I,Definiciones y reglas generales,2
"Art. 955 CC — Apertura de la sucesión","La sucesión en los bienes de una persona se abre al momento de su muerte en su último domicilio; salvos los casos expresamente exceptuados.",DERECHO_CIVIL,LIBRO_III,TITULO_I,Definiciones y reglas generales,1
"Art. 984 CC — Derecho de representación","Se sucede abintestato, ya por derecho personal, ya por derecho de representación. La representación es una ficción legal en que se supone que una persona tiene el lugar y por consiguiente el grado de parentesco y los derechos hereditarios que tendría su padre o madre, si éste o ésta no quisiese o no pudiese suceder.",DERECHO_CIVIL,LIBRO_III,TITULO_II,Reglas relativas a la sucesión intestada,2
"Art. 988 CC inc. 1 — Primer orden de sucesión intestada","Los hijos excluyen a todos los otros herederos, a menos que hubiere también cónyuge sobreviviente, caso en el cual éste concurrirá con aquéllos.",DERECHO_CIVIL,LIBRO_III,TITULO_II,Reglas relativas a la sucesión intestada,1
"Art. 959 CC — Bajas generales de la herencia","En toda sucesión por causa de muerte, para llevar a efecto las disposiciones del difunto o de la ley, se deducirán del acervo o masa de bienes que el difunto ha dejado las bajas generales que siguen: los gastos de última enfermedad y de entierro; las deudas hereditarias; los impuestos fiscales; las asignaciones alimenticias forzosas.",DERECHO_CIVIL,LIBRO_III,TITULO_I,Definiciones y reglas generales,2
