textoConErrores,textoOriginal,errores_json,totalErrores,explicacion,rama,libro,titulo,materia,dificultad
"El auto de prueba se notifica por estado diario. El recurso que procede es la apelación directa dentro de 10 días.","El auto de prueba se notifica por CÉDULA (art. 48). El recurso es REPOSICIÓN con apelación subsidiaria dentro de 3° DÍA (art. 319).","[{""id"":1,""textoIncorrecto"":""por estado diario"",""textoCorrecto"":""por cédula (art. 48)"",""explicacion"":""Art. 48 CPC: la resolución que recibe la causa a prueba se notifica por cédula.""},{""id"":2,""textoIncorrecto"":""apelación directa dentro de 10 días"",""textoCorrecto"":""reposición con apelación subsidiaria dentro de 3° día"",""explicacion"":""Art. 319 CPC: recurso especial de reposición + apelación subsidiaria en 3 días.""}]",2,"Arts. 48 y 319 CPC. Notificación por cédula y recurso especial del auto de prueba.",DERECHO_PROCESAL_CIVIL,LIBRO_II,TITULO_XI,De la recepción de la causa a prueba,2
"El término probatorio ordinario es de 15 días corridos. Es un plazo judicial, individual y prorrogable.","El término probatorio es de 20 días HÁBILES. Es un plazo LEGAL, COMÚN e IMPRORROGABLE.","[{""id"":1,""textoIncorrecto"":""15 días corridos"",""textoCorrecto"":""20 días hábiles"",""explicacion"":""Art. 328 CPC: 20 días hábiles (no corridos, art. 66).""},{""id"":2,""textoIncorrecto"":""judicial, individual y prorrogable"",""textoCorrecto"":""legal, común e improrrogable"",""explicacion"":""Art. 328: legal (fijado por ley), común (desde última notificación, art. 327), improrrogable.""}]",2,"Arts. 327-328 CPC. Las cuatro características del término probatorio ordinario.",DERECHO_PROCESAL_CIVIL,LIBRO_II,TITULO_XI,De la recepción de la causa a prueba,2
"La conciliación es un trámite voluntario que no tiene efecto de cosa juzgada. Procede en todos los juicios sin excepción.","La conciliación es trámite ESENCIAL con efecto de cosa juzgada (art. 267). NO procede en juicios ejecutivos ni en los del art. 313.","[{""id"":1,""textoIncorrecto"":""trámite voluntario sin cosa juzgada"",""textoCorrecto"":""trámite esencial cuya acta equivale a sentencia ejecutoriada"",""explicacion"":""Arts. 262 y 267 CPC: es obligatorio y el acta produce cosa juzgada.""},{""id"":2,""textoIncorrecto"":""todos los juicios sin excepción"",""textoCorrecto"":""excluye juicios ejecutivos y los del art. 313"",""explicacion"":""Art. 262 inc. 2 CPC: exclusión expresa de ejecutivos y casos sin hechos controvertidos.""}]",2,"Arts. 262 y 267 CPC. La conciliación es esencial, produce cosa juzgada y tiene excepciones.",DERECHO_PROCESAL_CIVIL,LIBRO_II,TITULO_II,De la conciliación,2
"Las medidas para mejor resolver se decretan a petición de parte, antes de la citación a oír sentencia. El plazo para observaciones a la prueba es de 5 días.","Las medidas se decretan DE OFICIO, DESPUÉS de la citación a oír sentencia (art. 159). Las observaciones son en 10 DÍAS (art. 430).","[{""id"":1,""textoIncorrecto"":""a petición de parte, antes de la citación"",""textoCorrecto"":""de oficio, después de la citación a oír sentencia"",""explicacion"":""Art. 159 CPC: las medidas para mejor resolver son de oficio y post-citación.""},{""id"":2,""textoIncorrecto"":""5 días"",""textoCorrecto"":""10 días"",""explicacion"":""Art. 430 CPC: 10 días siguientes al vencimiento del probatorio para observaciones.""}]",2,"Arts. 159 y 430 CPC. Medidas de oficio post-citación y plazo de observaciones.",DERECHO_PROCESAL_CIVIL,LIBRO_II,TITULO_XI,De la recepción de la causa a prueba,2
"La lista de testigos debe presentarse dentro de los 10 primeros días del probatorio. El término probatorio puede ampliarse por decisión del tribunal.","La lista debe presentarse en los 5 PRIMEROS días (art. 320). El término ordinario es IMPRORROGABLE.","[{""id"":1,""textoIncorrecto"":""10 primeros días"",""textoCorrecto"":""5 primeros días"",""explicacion"":""Art. 320 CPC: la lista de testigos en los 5 primeros días. 10 días es el plazo de observaciones.""},{""id"":2,""textoIncorrecto"":""puede ampliarse por decisión del tribunal"",""textoCorrecto"":""es improrrogable; solo puede reducirse por acuerdo de partes"",""explicacion"":""Art. 328 CPC: improrrogable. Solo reducible por acuerdo. Para prueba fuera del territorio existe el extraordinario.""}]",2,"Arts. 320 y 328 CPC. Plazo de lista de testigos y carácter improrrogable del probatorio.",DERECHO_PROCESAL_CIVIL,LIBRO_II,TITULO_XI,De la recepción de la causa a prueba,2
