textoConBlancos,blancos_json,explicacion,rama,libro,titulo,materia,dificultad
"En el juicio sumario, la audiencia de contestación se fija para el {1} día hábil. El término probatorio es de {2} días.","[{""id"":1,""correcta"":""quinto"",""opciones"":[""quinto"",""tercero"",""décimo"",""décimo quinto""]},{""id"":2,""correcta"":""ocho"",""opciones"":[""ocho"",""veinte"",""quince"",""tres""]}]","Arts. 683 y 686 CPC. Audiencia al 5° día + probatorio de 8 días.",DERECHO_PROCESAL_CIVIL,LIBRO_III,TITULO_XI,Del juicio sumario,1
"La querella de {1} protege contra perturbación. La querella de {2} protege contra despojo.","[{""id"":1,""correcta"":""amparo"",""opciones"":[""amparo"",""restitución"",""restablecimiento"",""dominio""]},{""id"":2,""correcta"":""restitución"",""opciones"":[""restitución"",""amparo"",""restablecimiento"",""posesión""]}]","Art. 549 CPC. Amparo = perturbación. Restitución = despojo.",DERECHO_PROCESAL_CIVIL,LIBRO_III,TITULO_IV,De los interdictos posesorios,1
"Las acciones posesorias prescriben en {1} año. La querella de restablecimiento prescribe en {2} meses.","[{""id"":1,""correcta"":""un"",""opciones"":[""un"",""dos"",""tres"",""cinco""]},{""id"":2,""correcta"":""seis"",""opciones"":[""seis"",""tres"",""doce"",""dos""]}]","Arts. 920 y 928 CC. 1 año general, 6 meses para restablecimiento.",DERECHO_PROCESAL_CIVIL,LIBRO_III,TITULO_IV,De los interdictos posesorios,2
"El arrendador debe dar {1} meses de anticipación para desahuciar. El arrendatario puede enervar pagando en {2} días.","[{""id"":1,""correcta"":""dos"",""opciones"":[""dos"",""tres"",""uno"",""seis""]},{""id"":2,""correcta"":""diez"",""opciones"":[""diez"",""cinco"",""quince"",""treinta""]}]","Arts. 3 y 10 Ley 18.101. Desahucio = 2 meses. Enervación = 10 días.",DERECHO_PROCESAL_CIVIL,LIBRO_III,TITULO_VI,Del juicio de arrendamiento,2
"Los juicios de arrendamiento se tramitan como juicio {1} según la Ley {2}.","[{""id"":1,""correcta"":""sumario"",""opciones"":[""sumario"",""ordinario"",""ejecutivo"",""especial""]},{""id"":2,""correcta"":""18.101"",""opciones"":[""18.101"",""19.968"",""20.720"",""18.092""]}]","Ley 18.101 sobre arrendamiento de predios urbanos. Procedimiento sumario con modificaciones.",DERECHO_PROCESAL_CIVIL,LIBRO_III,TITULO_VI,Del juicio de arrendamiento,1
"Para interponer acciones posesorias se requiere posesión tranquila de al menos {1} año. La querella de {2} no exige este requisito.","[{""id"":1,""correcta"":""un"",""opciones"":[""un"",""dos"",""tres"",""medio""]},{""id"":2,""correcta"":""restablecimiento"",""opciones"":[""restablecimiento"",""amparo"",""restitución"",""dominio""]}]","Arts. 918 y 928 CC. 1 año de posesión como regla; restablecimiento es la excepción.",DERECHO_PROCESAL_CIVIL,LIBRO_III,TITULO_IV,De los interdictos posesorios,2
"El juez fija un plazo para la restitución del inmueble no inferior a {1} días ni superior a {2} meses.","[{""id"":1,""correcta"":""treinta"",""opciones"":[""treinta"",""quince"",""diez"",""sesenta""]},{""id"":2,""correcta"":""seis"",""opciones"":[""seis"",""tres"",""doce"",""dos""]}]","Art. 13 Ley 18.101. Rango de 30 días a 6 meses para el desalojo.",DERECHO_PROCESAL_CIVIL,LIBRO_III,TITULO_VI,Del juicio de arrendamiento,2
