titulo,textoCompleto,rama,libro,titulo_materia,materia,dificultad
"Art. 817 CPC — Definición de actos no contenciosos","Son actos judiciales no contenciosos aquellos que según la ley requieren la intervención del juez y en que no se promueve contienda alguna entre partes.",DERECHO_PROCESAL_CIVIL,LIBRO_IV,TITULO_I,De los actos no contenciosos,1
"Art. 819 CPC — Apreciación de la prueba","En estos negocios el tribunal apreciará prudencialmente las pruebas y los antecedentes que se rindan, pudiendo en consecuencia admitir los que crea conducentes al esclarecimiento del asunto.",DERECHO_PROCESAL_CIVIL,LIBRO_IV,TITULO_I,De los actos no contenciosos,2
"Art. 821 CPC — Resoluciones negativas modificables","Pueden los tribunales, variando las circunstancias, y en mérito de los nuevos antecedentes que se les presenten, revocar o modificar las resoluciones negativas que hayan dictado, sin sujeción a los términos y formas establecidos para los asuntos contenciosos.",DERECHO_PROCESAL_CIVIL,LIBRO_IV,TITULO_I,De los actos no contenciosos,2
"Art. 823 CPC — Oposición de legítimo contradictor","Si a la solicitud presentada se hace oposición por legítimo contradictor, se hará contencioso el negocio y se sujetará a los trámites del juicio que corresponda.",DERECHO_PROCESAL_CIVIL,LIBRO_IV,TITULO_I,De los actos no contenciosos,2
"Art. 1240 CC — Herencia yacente","Si dentro de quince días de abrirse la sucesión no se hubiere aceptado la herencia o una cuota de ella, ni hubiere albacea a quien el testador haya conferido la tenencia de los bienes y que haya aceptado su encargo, el juez, a instancia del cónyuge sobreviviente, o de cualquiera de los parientes o dependientes del difunto, o de otra persona interesada en ello, o de oficio, declarará yacente la herencia.",DERECHO_PROCESAL_CIVIL,LIBRO_IV,TITULO_V,De la herencia yacente,2
