pregunta,opcion_a,opcion_b,opcion_c,opcion_d,correcta,explicacion,rama,libro,titulo,materia,dificultad
"El plazo para la réplica en el juicio ordinario es de:","6 días hábiles desde la notificación de la contestación (art. 311 CPC)","15 días hábiles","3 días hábiles","10 días hábiles",0,"Art. 311 CPC: 6 días para la réplica. Mismo plazo para la dúplica (art. 312). Son plazos legales, fatales e individuales.",DERECHO_PROCESAL_CIVIL,LIBRO_II,TITULO_IX,De la réplica y la dúplica,1
"La conciliación obligatoria del art. 262 CPC es:","Un trámite esencial en todo juicio civil en que sea admisible la transacción","Un trámite voluntario que depende de las partes","Solo obligatoria en juicios ejecutivos","Solo obligatoria en juicios de familia",0,"Art. 262 + 795 Nº 2 CPC: es trámite esencial de primera instancia. Su omisión es causal de casación en la forma.",DERECHO_PROCESAL_CIVIL,LIBRO_II,TITULO_II,De la conciliación,1
"Las opiniones del juez durante la audiencia de conciliación:","No lo inhabilitan para seguir conociendo del juicio (art. 263 CPC)","Lo inhabilitan de pleno derecho","Obligan a las partes a aceptar su propuesta","Deben constar en acta secreta",0,"Art. 263 CPC: garantía de que el juez puede proponer bases de arreglo libremente sin perder su imparcialidad para resolver el fondo.",DERECHO_PROCESAL_CIVIL,LIBRO_II,TITULO_II,De la conciliación,2
"Si se logra conciliación total, el acta se estima como:","Sentencia ejecutoriada para todos los efectos legales (art. 267 CPC)","Acuerdo privado sin valor judicial","Sentencia de primera instancia apelable","Medida provisional sujeta a confirmación",0,"Art. 267 CPC: el acta de conciliación es equivalente jurisdiccional. Produce cosa juzgada y es ejecutable como sentencia firme.",DERECHO_PROCESAL_CIVIL,LIBRO_II,TITULO_II,De la conciliación,2
"El auto de prueba es la resolución que:","Recibe la causa a prueba, fijando los hechos sustanciales, pertinentes y controvertidos (art. 318 CPC)","Dicta sentencia definitiva","Cita a las partes a conciliación","Declara la rebeldía del demandado",0,"Art. 318 CPC: el auto de prueba delimita la prueba. Los hechos fijados se llaman 'puntos de prueba'.",DERECHO_PROCESAL_CIVIL,LIBRO_II,TITULO_XI,De la recepción de la causa a prueba,1
"El auto de prueba se notifica por:","Cédula (art. 48 CPC)","Estado diario","Personalmente","Avisos",0,"Art. 48 CPC: la resolución que recibe la causa a prueba es una de las que expresamente se notifican por cédula.",DERECHO_PROCESAL_CIVIL,LIBRO_II,TITULO_XI,De la recepción de la causa a prueba,1
"El recurso que procede contra el auto de prueba es:","Reposición con apelación subsidiaria, dentro de 3° día (art. 319 CPC)","Solo apelación dentro de 10 días","Solo casación en la forma","No procede recurso alguno",0,"Art. 319 CPC: reposición (pedir al mismo tribunal que modifique los puntos de prueba) + apelación subsidiaria (si la reposición falla). Plazo: 3 días.",DERECHO_PROCESAL_CIVIL,LIBRO_II,TITULO_XI,De la recepción de la causa a prueba,2
"El término probatorio ordinario dura:","20 días hábiles (art. 328 CPC)","15 días hábiles","30 días hábiles","10 días hábiles",0,"Art. 328 CPC: 20 días. Puede reducirse por acuerdo de partes, pero no ampliarse (improrrogable).",DERECHO_PROCESAL_CIVIL,LIBRO_II,TITULO_XI,De la recepción de la causa a prueba,1
"El término probatorio ordinario es un plazo:","Legal, fatal, común e improrrogable","Judicial, no fatal e individual","Convencional y prorrogable","Legal, individual y prorrogable",0,"Cuatro características: legal (lo fija la ley), fatal (vence automáticamente), común (corre desde la última notificación), improrrogable (no se extiende).",DERECHO_PROCESAL_CIVIL,LIBRO_II,TITULO_XI,De la recepción de la causa a prueba,2
"La lista de testigos debe presentarse dentro de:","Los 5 primeros días del término probatorio (art. 320 CPC)","Los 10 primeros días","El último día del término","Antes de la demanda",0,"Art. 320 CPC: 5 días fatales. Sin lista de testigos, no puede rendirse prueba testimonial.",DERECHO_PROCESAL_CIVIL,LIBRO_II,TITULO_XI,De la recepción de la causa a prueba,1
"El término probatorio extraordinario procede para:","Rendir prueba fuera del territorio jurisdiccional del tribunal o fuera del país","Ampliar el plazo ordinario sin justificación","Rendir cualquier prueba dentro del territorio","Repetir prueba ya rendida",0,"Arts. 329-335 CPC: el extraordinario agrega días según la tabla de emplazamiento para prueba fuera del territorio del tribunal.",DERECHO_PROCESAL_CIVIL,LIBRO_II,TITULO_XI,De la recepción de la causa a prueba,2
"El término probatorio especial se concede cuando:","Durante el probatorio ocurre un entorpecimiento que impide rendir prueba (fuerza mayor, testigo inasistente)","Las partes lo piden sin justificación","El juez quiere ampliar el plazo de oficio","Se rinde prueba pericial compleja",0,"Arts. 339-340 CPC: el término especial compensa entorpecimientos específicos. Ej: testigo que no pudo declarar por enfermedad.",DERECHO_PROCESAL_CIVIL,LIBRO_II,TITULO_XI,De la recepción de la causa a prueba,2
"Las observaciones a la prueba pueden presentarse en:","10 días siguientes al vencimiento del término probatorio (art. 430 CPC)","5 días","3 días","15 días",0,"Art. 430 CPC: 10 días para que las partes analicen y argumenten sobre la prueba rendida. No son obligatorias.",DERECHO_PROCESAL_CIVIL,LIBRO_II,TITULO_XI,De la recepción de la causa a prueba,2
"Después de la citación a oír sentencia, las partes:","No pueden presentar más escritos ni rendir pruebas, salvo medidas para mejor resolver del tribunal","Pueden seguir presentando prueba libremente","Pueden modificar la demanda","Pueden allanarse pero no transigir",0,"Arts. 432-433 CPC: la citación cierra el debate. Solo el tribunal puede decretar medidas para mejor resolver (art. 159) de oficio.",DERECHO_PROCESAL_CIVIL,LIBRO_II,TITULO_XI,De la recepción de la causa a prueba,1
"Las medidas para mejor resolver del art. 159 CPC son:","Diligencias probatorias que el tribunal puede decretar de oficio después de la citación a oír sentencia","Pruebas que las partes rinden libremente","Medidas cautelares del demandante","Gestiones preparatorias del juicio",0,"Art. 159 CPC: agregación de documentos, confesión, inspección, peritos, testigos, presentación de autos. Son de oficio, no a petición de parte.",DERECHO_PROCESAL_CIVIL,LIBRO_II,TITULO_XI,De la recepción de la causa a prueba,2
"El plazo para dictar sentencia definitiva es de:","60 días desde que la causa quede en estado de sentencia (art. 162 CPC)","30 días","90 días","Sin plazo",0,"Art. 162 inc. 3 CPC: 60 días. Es plazo judicial (no fatal para el tribunal, pero su incumplimiento puede generar responsabilidad disciplinaria).",DERECHO_PROCESAL_CIVIL,LIBRO_II,TITULO_XI,De la recepción de la causa a prueba,2
"Si no hay hechos sustanciales, pertinentes y controvertidos:","El tribunal cita directamente a oír sentencia sin recibir la causa a prueba (art. 313 CPC)","El tribunal recibe la causa a prueba igualmente","El juicio se suspende hasta que surjan hechos controvertidos","Se declara desierta la instancia",0,"Art. 313 CPC: sin hechos controvertidos (por allanamiento total o por falta de controversia fáctica), se omite la etapa de prueba.",DERECHO_PROCESAL_CIVIL,LIBRO_II,TITULO_XI,De la recepción de la causa a prueba,2
"La conciliación NO procede en:","Juicios ejecutivos y juicios sin hechos controvertidos (art. 262 inc. 2 CPC)","Juicios ordinarios de mayor cuantía","Juicios sumarios","Juicios de arrendamiento",0,"Art. 262 inc. 2 CPC: excluye expresamente juicios ejecutivos. También se excluyen los del art. 313 (allanamiento, sin hechos controvertidos).",DERECHO_PROCESAL_CIVIL,LIBRO_II,TITULO_II,De la conciliación,2
"El auto de prueba es una resolución de tipo:","Sentencia interlocutoria (de segundo grado: sirve de base para la sentencia definitiva)","Sentencia definitiva","Decreto o providencia","Auto",0,"Art. 158 CPC: el auto de prueba resuelve un trámite que sirve de base para la sentencia definitiva. Es interlocutoria de 2° grado.",DERECHO_PROCESAL_CIVIL,LIBRO_II,TITULO_XI,De la recepción de la causa a prueba,2
"El término probatorio puede reducirse por:","Acuerdo unánime de las partes (art. 328 inc. 2 CPC)","Decisión unilateral del tribunal","Solicitud de una sola de las partes","Nunca puede reducirse",0,"Art. 328 inc. 2 CPC: las partes pueden reducirlo de común acuerdo. Pero NO pueden ampliarlo (improrrogable por su naturaleza legal).",DERECHO_PROCESAL_CIVIL,LIBRO_II,TITULO_XI,De la recepción de la causa a prueba,2
