textoConBlancos,blancos_json,explicacion,rama,libro,titulo,materia,dificultad
"La filiación es {1} cuando existe matrimonio entre los padres al tiempo de la {2} o del nacimiento del hijo.","[{""id"":1,""correcta"":""matrimonial"",""opciones"":[""matrimonial"",""legítima"",""natural"",""determinada""]},{""id"":2,""correcta"":""concepción"",""opciones"":[""concepción"",""inscripción"",""gestación"",""convivencia""]}]","Art. 180 CC. Filiación matrimonial si hay matrimonio al tiempo de la concepción o del nacimiento.",DERECHO_CIVIL,LIBRO_I,TITULO_VII,De la filiación,1
"Se presumen hijos del {1} los nacidos después de la celebración del matrimonio y dentro de los {2} días siguientes a su disolución o a la separación judicial.","[{""id"":1,""correcta"":""marido"",""opciones"":[""marido"",""padre"",""cónyuge"",""hombre""]},{""id"":2,""correcta"":""trescientos"",""opciones"":[""trescientos"",""ciento ochenta"",""doscientos"",""trescientos sesenta""]}]","Art. 184 CC. Presunción simplemente legal de paternidad del marido.",DERECHO_CIVIL,LIBRO_I,TITULO_VII,De la filiación,2
"El reconocimiento es un acto {1} e irrevocable, aunque se contenga en un {2} revocado.","[{""id"":1,""correcta"":""unilateral"",""opciones"":[""unilateral"",""bilateral"",""consensual"",""judicial""]},{""id"":2,""correcta"":""testamento"",""opciones"":[""testamento"",""contrato"",""decreto"",""acuerdo""]}]","Art. 189 CC. El reconocimiento voluntario es irrevocable incluso si consta en testamento que luego se revoca.",DERECHO_CIVIL,LIBRO_I,TITULO_VII,De la filiación,2
"La acción de reclamación de filiación es {1} e irrenunciable respecto del {2}.","[{""id"":1,""correcta"":""imprescriptible"",""opciones"":[""imprescriptible"",""prescriptible"",""caducable"",""temporal""]},{""id"":2,""correcta"":""hijo"",""opciones"":[""hijo"",""padre"",""demandante"",""juez""]}]","Art. 195 CC. El hijo puede reclamar su filiación en cualquier momento de su vida.",DERECHO_CIVIL,LIBRO_I,TITULO_VIII,De las acciones de filiación,1
"Toca de {1} a los padres, o al padre o madre sobreviviente, el cuidado personal de la crianza y {2} de sus hijos.","[{""id"":1,""correcta"":""consuno"",""opciones"":[""consuno"",""común"",""turno"",""acuerdo""]},{""id"":2,""correcta"":""educación"",""opciones"":[""educación"",""manutención"",""protección"",""formación""]}]","Art. 224 CC. El cuidado personal corresponde a ambos padres conjuntamente (de consuno).",DERECHO_CIVIL,LIBRO_I,TITULO_IX,De los derechos y obligaciones entre los padres y los hijos,1
"La patria potestad es el conjunto de derechos y deberes que corresponden al padre o a la madre sobre los {1} de sus hijos no {2}.","[{""id"":1,""correcta"":""bienes"",""opciones"":[""bienes"",""derechos"",""actos"",""personas""]},{""id"":2,""correcta"":""emancipados"",""opciones"":[""emancipados"",""casados"",""mayores"",""habilitados""]}]","Art. 243 CC. La patria potestad es exclusivamente patrimonial y termina con la emancipación.",DERECHO_CIVIL,LIBRO_I,TITULO_X,De la patria potestad,1
"Toda emancipación, una vez efectuada, es {1}. Exceptúase únicamente la fundada en la muerte {2} del padre o madre.","[{""id"":1,""correcta"":""irrevocable"",""opciones"":[""irrevocable"",""definitiva"",""absoluta"",""permanente""]},{""id"":2,""correcta"":""presunta"",""opciones"":[""presunta"",""natural"",""civil"",""aparente""]}]","Art. 272 CC. Regla general: irrevocabilidad. Única excepción: muerte presunta si reaparece el padre/madre.",DERECHO_CIVIL,LIBRO_I,TITULO_X,De la patria potestad,2
