textoConBlancos,blancos_json,explicacion,rama,libro,titulo,materia,dificultad
"El {1} de abogado debe constituirse en la primera presentación. Sin él, el escrito se tiene por no {2} para todos los efectos legales.","[{""id"":1,""correcta"":""patrocinio"",""opciones"":[""patrocinio"",""mandato"",""poder"",""contrato""]},{""id"":2,""correcta"":""presentado"",""opciones"":[""presentado"",""recibido"",""admitido"",""válido""]}]","Art. 1 Ley 18.120. Sin patrocinio: no presentado (sanción inmediata y grave).",DERECHO_PROCESAL_CIVIL,LIBRO_I,TITULO_III,De la comparecencia en juicio,1
"El mandato judicial puede constituirse por escritura {1}, acta ante el juez, o declaración escrita autorizada por el {2} del tribunal.","[{""id"":1,""correcta"":""pública"",""opciones"":[""pública"",""privada"",""simple"",""notarial""]},{""id"":2,""correcta"":""secretario"",""opciones"":[""secretario"",""juez"",""notario"",""receptor""]}]","Art. 6 CPC. Tres formas de constituir el mandato judicial.",DERECHO_PROCESAL_CIVIL,LIBRO_I,TITULO_III,De la comparecencia en juicio,2
"Las facultades {1} del mandato judicial se entienden conferidas sin mención expresa. Las {2} requieren mención expresa.","[{""id"":1,""correcta"":""ordinarias"",""opciones"":[""ordinarias"",""especiales"",""generales"",""básicas""]},{""id"":2,""correcta"":""extraordinarias"",""opciones"":[""extraordinarias"",""especiales"",""ampliadas"",""adicionales""]}]","Art. 7 CPC. Ordinarias = por defecto. Extraordinarias = mención expresa obligatoria.",DERECHO_PROCESAL_CIVIL,LIBRO_I,TITULO_III,De la comparecencia en juicio,2
"El litis consorcio {1} se produce cuando hay varios demandantes; el {2} cuando hay varios demandados.","[{""id"":1,""correcta"":""activo"",""opciones"":[""activo"",""pasivo"",""mixto"",""necesario""]},{""id"":2,""correcta"":""pasivo"",""opciones"":[""pasivo"",""activo"",""alternativo"",""facultativo""]}]","Art. 18 CPC. Activo = varios actores. Pasivo = varios demandados. Mixto = ambos.",DERECHO_PROCESAL_CIVIL,LIBRO_I,TITULO_II,De las partes,1
"Para intervenir como tercero en un juicio se requiere tener interés {1} en los resultados, no meramente {2}.","[{""id"":1,""correcta"":""actual"",""opciones"":[""actual"",""futuro"",""posible"",""general""]},{""id"":2,""correcta"":""eventual"",""opciones"":[""eventual"",""directo"",""personal"",""económico""]}]","Arts. 22-23 CPC. El interés debe ser actual al momento de solicitar la intervención.",DERECHO_PROCESAL_CIVIL,LIBRO_I,TITULO_II,De las partes,2
"En caso de {1} consorcio, las partes deben litigar por medio de un procurador {2}, salvo incompatibilidad de intereses.","[{""id"":1,""correcta"":""litis"",""opciones"":[""litis"",""un"",""co"",""multi""]},{""id"":2,""correcta"":""común"",""opciones"":[""común"",""especial"",""judicial"",""independiente""]}]","Art. 19 CPC. Procurador común obligatorio; excepción en art. 20 (intereses contrapuestos).",DERECHO_PROCESAL_CIVIL,LIBRO_I,TITULO_II,De las partes,2
"La {1} procesal es la calidad de titular del derecho que habilita para demandar. La {2} es el derecho abstracto de poner en movimiento la jurisdicción.","[{""id"":1,""correcta"":""legitimación"",""opciones"":[""legitimación"",""capacidad"",""competencia"",""habilitación""]},{""id"":2,""correcta"":""acción"",""opciones"":[""acción"",""pretensión"",""demanda"",""excepción""]}]","Legitimación = relación concreta con el derecho. Acción = derecho abstracto a la jurisdicción.",DERECHO_PROCESAL_CIVIL,LIBRO_I,TITULO_I,De las reglas comunes a todo procedimiento,2
