titulo,columnaIzqLabel,columnaDerLabel,pares_json,explicacion,rama,libro,titulo_materia,materia,dificultad
"Juicio ordinario vs. sumario vs. ejecutivo","Aspecto","Ordinario / Sumario / Ejecutivo","[{""id"":1,""izquierda"":""Plazo para defenderse"",""derecha"":""Ordinario: 15 días | Sumario: audiencia al 5° día | Ejecutivo: 4 días""},{""id"":2,""izquierda"":""Término probatorio"",""derecha"":""Ordinario: 20 días | Sumario: 8 días | Ejecutivo: 10 días""},{""id"":3,""izquierda"":""Conciliación"",""derecha"":""Ordinario: obligatoria | Sumario: obligatoria (en audiencia) | Ejecutivo: excluida""},{""id"":4,""izquierda"":""Apelación de definitiva"",""derecha"":""Ordinario: ambos efectos | Sumario: solo devolutivo | Ejecutivo: depende""}]","CPC. Cuadro comparativo de los tres procedimientos principales del sistema.",DERECHO_PROCESAL_CIVIL,LIBRO_III,TITULO_XI,Del juicio sumario,2
"Tres querellas posesorias","Querella","Protege contra","[{""id"":1,""izquierda"":""Amparo"",""derecha"":""Perturbación: el poseedor no pierde la posesión pero se le molesta""},{""id"":2,""izquierda"":""Restitución"",""derecha"":""Despojo: el poseedor pierde la posesión y quiere recuperarla""},{""id"":3,""izquierda"":""Restablecimiento"",""derecha"":""Despojo violento: protege incluso al mero tenedor. Prescribe en 6 meses""}]","Arts. 549 CPC y 928 CC. Tres niveles de protección posesoria según la gravedad.",DERECHO_PROCESAL_CIVIL,LIBRO_III,TITULO_IV,De los interdictos posesorios,1
"Causales de terminación del arrendamiento (Ley 18.101)","Causal","Descripción","[{""id"":1,""izquierda"":""No pago de rentas"",""derecha"":""El arrendatario no paga; puede enervar pagando en 10 días (una sola vez)""},{""id"":2,""izquierda"":""Necesidad del arrendador"",""derecha"":""El arrendador necesita habitar el inmueble él o su familia directa""},{""id"":3,""izquierda"":""Subarriendo no autorizado"",""derecha"":""El arrendatario subarrienda sin permiso escrito del arrendador""},{""id"":4,""izquierda"":""Deterioro culpable"",""derecha"":""El arrendatario daña el inmueble por culpa o negligencia""}]","Ley 18.101. Las cuatro causales principales de terminación del arriendo urbano.",DERECHO_PROCESAL_CIVIL,LIBRO_III,TITULO_VI,Del juicio de arrendamiento,2
"Acciones posesorias especiales","Acción","Objeto","[{""id"":1,""izquierda"":""Denuncia de obra nueva"",""derecha"":""Suspender una obra nueva perjudicial para la posesión (arts. 565-570)""},{""id"":2,""izquierda"":""Denuncia de obra ruinosa"",""derecha"":""Demoler o reparar edificio que amenaza ruina (arts. 571-576)""},{""id"":3,""izquierda"":""Interdictos especiales"",""derecha"":""Proteger servidumbres, caminos, aguas (arts. 577-583)""}]","CPC arts. 565-583. Acciones posesorias más allá del amparo y la restitución.",DERECHO_PROCESAL_CIVIL,LIBRO_III,TITULO_IV,De los interdictos posesorios,2
"Plazos clave en arrendamiento (Ley 18.101)","Concepto","Plazo","[{""id"":1,""izquierda"":""Desahucio del arrendador (mes a mes)"",""derecha"":""2 meses de anticipación (art. 3)""},{""id"":2,""izquierda"":""Desahucio del arrendatario"",""derecha"":""1 período de pago (1 mes)""},{""id"":3,""izquierda"":""Enervación por no pago"",""derecha"":""10 días desde la notificación de la demanda (art. 10)""},{""id"":4,""izquierda"":""Plazo para restituir (sentencia)"",""derecha"":""30 días a 6 meses, fijado por el juez (art. 13)""}]","Ley 18.101. Los cuatro plazos esenciales del juicio de arrendamiento.",DERECHO_PROCESAL_CIVIL,LIBRO_III,TITULO_VI,Del juicio de arrendamiento,2
