textoConBlancos,blancos_json,explicacion,rama,libro,titulo,materia,dificultad
"La demanda debe contener la designación del tribunal, individualización de las partes, exposición de {1} y fundamentos de derecho, y las {2} concretas.","[{""id"":1,""correcta"":""hechos"",""opciones"":[""hechos"",""pruebas"",""testigos"",""leyes""]},{""id"":2,""correcta"":""peticiones"",""opciones"":[""peticiones"",""excepciones"",""defensas"",""alegaciones""]}]","Art. 254 CPC. Cuatro requisitos esenciales de la demanda.",DERECHO_PROCESAL_CIVIL,LIBRO_II,TITULO_I,Del juicio ordinario,1
"El plazo de emplazamiento en el juicio ordinario es de {1} días hábiles si el demandado es notificado en la misma {2} del tribunal.","[{""id"":1,""correcta"":""quince"",""opciones"":[""quince"",""diez"",""veinte"",""cinco""]},{""id"":2,""correcta"":""comuna"",""opciones"":[""comuna"",""región"",""provincia"",""ciudad""]}]","Art. 258 CPC. 15 días base + aumentos según distancia.",DERECHO_PROCESAL_CIVIL,LIBRO_II,TITULO_I,Del juicio ordinario,1
"Las excepciones {1} se refieren a la corrección del procedimiento. Las excepciones {2} atacan el fondo de la acción.","[{""id"":1,""correcta"":""dilatorias"",""opciones"":[""dilatorias"",""perentorias"",""mixtas"",""previas""]},{""id"":2,""correcta"":""perentorias"",""opciones"":[""perentorias"",""dilatorias"",""procesales"",""formales""]}]","Arts. 303 y 309 CPC. Dilatorias = forma. Perentorias = fondo.",DERECHO_PROCESAL_CIVIL,LIBRO_II,TITULO_VI,De las excepciones dilatorias,1
"Todas las excepciones dilatorias deben oponerse {1} en un mismo escrito, dentro del término de {2}.","[{""id"":1,""correcta"":""conjuntamente"",""opciones"":[""conjuntamente"",""separadamente"",""sucesivamente"",""alternativamente""]},{""id"":2,""correcta"":""emplazamiento"",""opciones"":[""emplazamiento"",""prueba"",""sentencia"",""apelación""]}]","Art. 305 CPC. Todas juntas + dentro del plazo para contestar.",DERECHO_PROCESAL_CIVIL,LIBRO_II,TITULO_VI,De las excepciones dilatorias,2
"La {1} es la demanda que el demandado formula contra el demandante, en su escrito de {2} de la demanda.","[{""id"":1,""correcta"":""reconvención"",""opciones"":[""reconvención"",""excepción"",""réplica"",""apelación""]},{""id"":2,""correcta"":""contestación"",""opciones"":[""contestación"",""réplica"",""dúplica"",""apelación""]}]","Art. 314 CPC. La reconvención se deduce en la contestación: misma oportunidad procesal.",DERECHO_PROCESAL_CIVIL,LIBRO_II,TITULO_VIII,De la reconvención,1
"Resueltas las excepciones dilatorias, el demandado tiene {1} días para contestar la demanda, contados desde la {2} de la resolución.","[{""id"":1,""correcta"":""diez"",""opciones"":[""diez"",""quince"",""cinco"",""veinte""]},{""id"":2,""correcta"":""notificación"",""opciones"":[""notificación"",""dictación"",""publicación"",""firma""]}]","Art. 308 CPC. Plazo especial de 10 días (no los 15 originales).",DERECHO_PROCESAL_CIVIL,LIBRO_II,TITULO_VI,De las excepciones dilatorias,2
"Las excepciones de {1}, cosa juzgada, transacción y pago efectivo pueden oponerse en {2} estado del juicio.","[{""id"":1,""correcta"":""prescripción"",""opciones"":[""prescripción"",""incompetencia"",""litis pendencia"",""ineptitud""]},{""id"":2,""correcta"":""cualquier"",""opciones"":[""cualquier"",""primer"",""último"",""segundo""]}]","Art. 310 CPC. Cuatro excepciones perentorias alegables en todo momento.",DERECHO_PROCESAL_CIVIL,LIBRO_II,TITULO_VII,De la contestación de la demanda,2
