textoConBlancos,blancos_json,explicacion,rama,libro,titulo,materia,dificultad
"La apelación tiene por objeto que el tribunal {1} enmiende la resolución del {2}.","[{""id"":1,""correcta"":""superior"",""opciones"":[""superior"",""inferior"",""mismo"",""arbitral""]},{""id"":2,""correcta"":""inferior"",""opciones"":[""inferior"",""superior"",""competente"",""recurrido""]}]","Art. 186 CPC. Superior enmienda al inferior: esencia de la apelación.",DERECHO_PROCESAL_CIVIL,LIBRO_III,TITULO_XVIII,De la apelación,1
"La casación en el fondo tiene una sola causal: infracción de {1} que influye sustancialmente en lo {2} del fallo.","[{""id"":1,""correcta"":""ley"",""opciones"":[""ley"",""procedimiento"",""forma"",""prueba""]},{""id"":2,""correcta"":""dispositivo"",""opciones"":[""dispositivo"",""considerativo"",""expositivo"",""probatorio""]}]","Art. 767 CPC. Ley + influencia sustancial en lo dispositivo.",DERECHO_PROCESAL_CIVIL,LIBRO_III,TITULO_XIX,De la casación en el fondo,2
"El plazo para apelar es de {1} días para sentencias definitivas y de {2} días para interlocutorias.","[{""id"":1,""correcta"":""diez"",""opciones"":[""diez"",""cinco"",""quince"",""tres""]},{""id"":2,""correcta"":""cinco"",""opciones"":[""cinco"",""diez"",""tres"",""quince""]}]","Art. 189 CPC. 10 para definitivas, 5 para interlocutorias.",DERECHO_PROCESAL_CIVIL,LIBRO_III,TITULO_XVIII,De la apelación,1
"El plazo para interponer casación en la forma y en el fondo es de {1} días. Se interponen ante la {2} Suprema.","[{""id"":1,""correcta"":""quince"",""opciones"":[""quince"",""diez"",""veinte"",""cinco""]},{""id"":2,""correcta"":""Corte"",""opciones"":[""Corte"",""Sala"",""Cámara"",""Fiscalía""]}]","Arts. 767-770 CPC. 15 días. La casación en el fondo es exclusiva de la CS; la de forma puede ser ante CA o CS.",DERECHO_PROCESAL_CIVIL,LIBRO_III,TITULO_XIX,De la casación en la forma,2
"La {1} es causal de casación en la forma cuando la sentencia otorga más de lo {2} por las partes.","[{""id"":1,""correcta"":""ultrapetita"",""opciones"":[""ultrapetita"",""incompetencia"",""nulidad"",""prescripción""]},{""id"":2,""correcta"":""pedido"",""opciones"":[""pedido"",""probado"",""alegado"",""pagado""]}]","Art. 768 Nº 4 CPC. Ultrapetita = más de lo pedido. Principio de congruencia.",DERECHO_PROCESAL_CIVIL,LIBRO_III,TITULO_XIX,De la casación en la forma,2
"El recurso de queja solo procede contra resoluciones que no sean susceptibles de {1} alguno. Es un recurso {2}.","[{""id"":1,""correcta"":""recurso"",""opciones"":[""recurso"",""apelación"",""reposición"",""trámite""]},{""id"":2,""correcta"":""subsidiario"",""opciones"":[""subsidiario"",""principal"",""ordinario"",""automático""]}]","Art. 545 COT. Solo cuando no hay otro recurso disponible.",DERECHO_PROCESAL_CIVIL,LIBRO_III,TITULO_XIX,Del recurso de queja,2
"Si se acoge la casación en el {1}, la CS dicta sentencia de {2} aplicando correctamente la ley.","[{""id"":1,""correcta"":""fondo"",""opciones"":[""fondo"",""forma"",""derecho"",""recurso""]},{""id"":2,""correcta"":""reemplazo"",""opciones"":[""reemplazo"",""nulidad"",""reenvío"",""confirmación""]}]","Art. 785 CPC. La CS no reenvía: invalida y dicta sentencia de reemplazo.",DERECHO_PROCESAL_CIVIL,LIBRO_III,TITULO_XIX,De la casación en el fondo,2
