textoConErrores,textoOriginal,errores_json,totalErrores,explicacion,rama,libro,titulo,materia,dificultad
"Las implicancias son de orden privado y la parte debe alegarlas. Las recusaciones son de orden público y el juez debe inhabilitarse de oficio.","Están INVERTIDAS. Implicancias = orden PÚBLICO (de oficio). Recusaciones = orden PRIVADO (a petición de parte).","[{""id"":1,""textoIncorrecto"":""implicancias de orden privado, la parte alega"",""textoCorrecto"":""implicancias de orden PÚBLICO, el juez se inhabilita de oficio"",""explicacion"":""Art. 195 COT: implicancia = grave = orden público = de oficio.""},{""id"":2,""textoIncorrecto"":""recusaciones de orden público, juez de oficio"",""textoCorrecto"":""recusaciones de orden PRIVADO, la parte debe alegarlas"",""explicacion"":""Art. 196 COT: recusación = menos grave = orden privado = a petición.""}]",2,"Arts. 195-196 COT. Inversión clásica entre implicancia y recusación.",DERECHO_ORGANICO,COT,TITULO_XII,De las implicancias y recusaciones,1
"Los receptores exponen los asuntos ante la sala de la CA. Los fiscales judiciales son lo mismo que los fiscales del Ministerio Público.","Los RELATORES exponen ante la sala (no receptores). Los fiscales judiciales son DISTINTOS del MP (PJ vs. autónomo).","[{""id"":1,""textoIncorrecto"":""receptores exponen ante la sala"",""textoCorrecto"":""los RELATORES exponen ante la sala (relación). Los receptores notifican fuera del tribunal"",""explicacion"":""Art. 372 COT: relatores = relación. Art. 390: receptores = notificaciones y embargos.""},{""id"":2,""textoIncorrecto"":""fiscales judiciales = fiscales del MP"",""textoCorrecto"":""son instituciones distintas: judicial (PJ) vs. MP (autónomo)"",""explicacion"":""Fiscal judicial = auxiliar del PJ. Fiscal del MP = investiga delitos (art. 83 CPR).""}]",2,"Arts. 350-393 COT. Distinción entre auxiliares y entre fiscalías.",DERECHO_ORGANICO,COT,TITULO_XI,De los auxiliares,1
"El conservador solo lleva el registro de propiedad. La recusación sin causa procede contra todos los jueces del país.","Lleva TRES registros (Propiedad, Hipotecas, Interdicciones). La recusación sin causa solo procede contra ABOGADOS INTEGRANTES.","[{""id"":1,""textoIncorrecto"":""solo el registro de propiedad"",""textoCorrecto"":""tres registros: Propiedad + Hipotecas y Gravámenes + Interdicciones"",""explicacion"":""Art. 31 Reglamento CBR: tres registros del sistema inmobiliario.""},{""id"":2,""textoIncorrecto"":""contra todos los jueces"",""textoCorrecto"":""solo contra abogados integrantes, una vez por parte (art. 198)"",""explicacion"":""Art. 198 COT: mecanismo especial limitado a abogados integrantes.""}]",2,"Arts. 198 COT y Reglamento CBR. Registros del CBR y alcance de la recusación sin causa.",DERECHO_ORGANICO,COT,TITULO_XI,De los conservadores,2
"Los defensores públicos del COT defienden imputados en causas penales. La amistad íntima con una parte es causal de implicancia.","Los defensores públicos protegen INCAPACES y AUSENTES (no imputados). La amistad íntima es causal de RECUSACIÓN (no implicancia).","[{""id"":1,""textoIncorrecto"":""defienden imputados penales"",""textoCorrecto"":""protegen incapaces y ausentes sin representante legal (art. 365)"",""explicacion"":""Art. 365 COT: defensor público del COT ≠ Defensoría Penal Pública.""},{""id"":2,""textoIncorrecto"":""amistad íntima es implicancia"",""textoCorrecto"":""es causal de RECUSACIÓN (art. 196 Nº 15)"",""explicacion"":""Art. 196 Nº 15 COT: amistad/enemistad = recusación. Las implicancias son más graves (ser parte, parentesco cercano, haber sido abogado).""}]",2,"Arts. 196 y 365 COT. Defensores del COT y clasificación correcta de causales.",DERECHO_ORGANICO,COT,TITULO_XII,De las recusaciones,2
"La escritura pública puede otorgarse ante cualquier abogado. El parentesco hasta 4° grado de consanguinidad siempre es implicancia.","La escritura se otorga ante NOTARIO (art. 403). Parentesco hasta 2° grado = implicancia; 3°-4° = RECUSACIÓN.","[{""id"":1,""textoIncorrecto"":""ante cualquier abogado"",""textoCorrecto"":""ante NOTARIO con solemnidades legales (art. 403 COT)"",""explicacion"":""Solo el notario puede autorizar escrituras públicas. No cualquier abogado.""},{""id"":2,""textoIncorrecto"":""hasta 4° grado siempre es implicancia"",""textoCorrecto"":""hasta 2° = implicancia (art. 195); 3°-4° = recusación (art. 196)"",""explicacion"":""La gravedad varía según la cercanía del parentesco.""}]",2,"Arts. 195-196 y 403 COT. Escritura ante notario y gradación del parentesco.",DERECHO_ORGANICO,COT,TITULO_XII,De las implicancias y recusaciones,2
