titulo,columnaIzqLabel,columnaDerLabel,pares_json,explicacion,rama,libro,titulo_materia,materia,dificultad
"Seis medios de prueba y su valor probatorio","Medio de prueba","Valor probatorio","[{""id"":1,""izquierda"":""Instrumento público"",""derecha"":""Plena fe erga omnes (art. 1700 CC)""},{""id"":2,""izquierda"":""Instrumento privado reconocido"",""derecha"":""Mismo valor que instrumento público entre las partes""},{""id"":3,""izquierda"":""Dos testigos contestes"",""derecha"":""Plena prueba (art. 384 Nº 2 CPC)""},{""id"":4,""izquierda"":""Confesión judicial (hechos personales)"",""derecha"":""Plena prueba irrefutable (art. 1713 CC)""},{""id"":5,""izquierda"":""Inspección personal del tribunal"",""derecha"":""Plena prueba sobre hechos materiales (art. 408)""},{""id"":6,""izquierda"":""Informe de peritos"",""derecha"":""Sana crítica: no constituye plena prueba por sí solo (art. 425)""}]","Arts. 341-425 CPC. Cuadro esencial de medios de prueba y su valoración.",DERECHO_PROCESAL_CIVIL,LIBRO_II,TITULO_XI,De los medios de prueba,2
"Instrumento público vs. privado","Aspecto","Público / Privado","[{""id"":1,""izquierda"":""Otorgamiento"",""derecha"":""Público: funcionario competente + solemnidades | Privado: sin funcionario ni solemnidades""},{""id"":2,""izquierda"":""Valor probatorio"",""derecha"":""Público: plena fe desde otorgamiento | Privado: sin valor hasta reconocimiento""},{""id"":3,""izquierda"":""Alcance"",""derecha"":""Público: erga omnes | Privado reconocido: solo entre las partes""},{""id"":4,""izquierda"":""Impugnación"",""derecha"":""Público: nulidad, falsedad, simulación | Privado: objeción dentro de 6° día (art. 346 Nº 3)""}]","Arts. 1699-1700 CC y 346 CPC. Diferencias fundamentales entre ambos tipos de instrumentos.",DERECHO_PROCESAL_CIVIL,LIBRO_II,TITULO_XI,De la prueba instrumental,2
"Tres sistemas de valoración de la prueba","Sistema","Descripción y aplicación en Chile","[{""id"":1,""izquierda"":""Prueba legal tasada"",""derecha"":""La ley fija el valor de cada medio. Sistema GENERAL del CPC chileno""},{""id"":2,""izquierda"":""Sana crítica"",""derecha"":""Juez valora según lógica, experiencia y ciencia. En CPC: solo peritaje (art. 425)""},{""id"":3,""izquierda"":""Libre convicción"",""derecha"":""El juez valora libremente sin reglas. No se aplica en el CPC civil""}]","Doctrina procesal. Chile usa prueba legal tasada como regla, sana crítica como excepción.",DERECHO_PROCESAL_CIVIL,LIBRO_II,TITULO_XI,De los medios de prueba,2
"Confesión: tipos y consecuencias","Tipo","Efecto","[{""id"":1,""izquierda"":""Judicial espontánea"",""derecha"":""La parte reconoce un hecho voluntariamente en un escrito o audiencia""},{""id"":2,""izquierda"":""Judicial provocada (posiciones)"",""derecha"":""Se provoca mediante pliego de preguntas bajo juramento (art. 385)""},{""id"":3,""izquierda"":""Confesión ficta"",""derecha"":""Se tiene por confeso al que no comparece o da respuestas evasivas (art. 394)""},{""id"":4,""izquierda"":""Extrajudicial"",""derecha"":""Fuera del juicio: menor valor, sirve de base para presunción judicial (art. 398)""}]","Arts. 385-402 CPC. Cuatro formas de confesión con distintos efectos.",DERECHO_PROCESAL_CIVIL,LIBRO_II,TITULO_XI,De la confesión de parte,2
"Presunciones: legales vs. judiciales","Tipo","Características","[{""id"":1,""izquierda"":""De derecho"",""derecha"":""Establecidas por la ley; NO admiten prueba en contrario (art. 47 CC)""},{""id"":2,""izquierda"":""Simplemente legales"",""derecha"":""Establecidas por la ley; SÍ admiten prueba en contrario (art. 47 CC)""},{""id"":3,""izquierda"":""Judiciales"",""derecha"":""Establecidas por el juez; deben ser graves, precisas y concordantes (art. 1712 CC)""}]","Arts. 47 CC y 1712 CC. Tres tipos con distinta fuerza y origen.",DERECHO_PROCESAL_CIVIL,LIBRO_II,TITULO_XI,De las presunciones,2
