titulo,columnaIzqLabel,columnaDerLabel,pares_json,explicacion,rama,libro,titulo_materia,materia,dificultad
"Título vs. Modo en la compraventa","Concepto","Función","[{""id"":1,""izquierda"":""Compraventa (contrato)"",""derecha"":""Título: antecedente jurídico que justifica la transferencia""},{""id"":2,""izquierda"":""Tradición (entrega/inscripción)"",""derecha"":""Modo: acto que efectivamente transfiere el dominio""},{""id"":3,""izquierda"":""Escritura pública"",""derecha"":""Solemnidad del contrato de compraventa de inmuebles""},{""id"":4,""izquierda"":""Inscripción CBR"",""derecha"":""Tradición del inmueble: modo de adquirir dominio""}]","Arts. 675, 686, 1793, 1801 CC. No confundir solemnidad con tradición.",DERECHO_CIVIL,LIBRO_IV,TITULO_XXIII,De la compraventa,1
"Lesión enorme: vendedor vs. comprador","Parte afectada","Cuándo hay lesión","[{""id"":1,""izquierda"":""Vendedor"",""derecha"":""Cuando el precio recibido es inferior a la mitad del justo precio""},{""id"":2,""izquierda"":""Comprador"",""derecha"":""Cuando el justo precio es inferior a la mitad del precio pagado""}]","Art. 1889 CC. Vendedor: vendió muy barato. Comprador: pagó demasiado caro.",DERECHO_CIVIL,LIBRO_IV,TITULO_XXIII,De la compraventa,2
"Acciones por vicios redhibitorios: redhibitoria vs. quanti minoris","Acción","Efecto y plazo","[{""id"":1,""izquierda"":""Redhibitoria"",""derecha"":""Rescisión de la venta. 6 meses muebles / 1 año inmuebles""},{""id"":2,""izquierda"":""Quanti minoris (estimatoria)"",""derecha"":""Rebaja proporcional del precio. 1 año muebles / 18 meses inmuebles""}]","Arts. 1860-1866 CC. La redhibitoria es más radical; la estimatoria conserva el contrato.",DERECHO_CIVIL,LIBRO_IV,TITULO_XXIII,De la compraventa,2
"Saneamiento de evicción: dos facetas","Faceta","Descripción","[{""id"":1,""izquierda"":""Obligación de hacer"",""derecha"":""Defender al comprador en juicio: comparecer como tercero citado de evicción""},{""id"":2,""izquierda"":""Obligación de dar"",""derecha"":""Indemnizar si el comprador es evicto: restituir precio + perjuicios""}]","Arts. 1838-1855 CC. La evicción genera primero defensa y luego, si se pierde, indemnización.",DERECHO_CIVIL,LIBRO_IV,TITULO_XXIII,De la compraventa,2
"Incapacidades especiales de la compraventa","Personas impedidas","Norma y razón","[{""id"":1,""izquierda"":""Cónyuges no separados judicialmente"",""derecha"":""Art. 1796: evitar fraude a terceros y simulación""},{""id"":2,""izquierda"":""Padre/madre e hijo bajo patria potestad"",""derecha"":""Art. 1797: proteger al hijo de conflicto de intereses""},{""id"":3,""izquierda"":""Empleados públicos sobre bienes de su ministerio"",""derecha"":""Art. 1798: prevenir abuso de la función pública""}]","Arts. 1796-1798 CC. Tres incapacidades especiales fundadas en protección de intereses.",DERECHO_CIVIL,LIBRO_IV,TITULO_XXIII,De la compraventa,2
