textoConErrores,textoOriginal,errores_json,totalErrores,explicacion,rama,libro,titulo,materia,dificultad
"La postura mínima en el remate de inmuebles es la mitad del avalúo. Los bienes muebles se rematan ante el tribunal en pública subasta.","La postura mínima es 2/3 del avalúo (art. 493). Los MUEBLES se venden en martillo; los INMUEBLES se rematan ante el tribunal.","[{""id"":1,""textoIncorrecto"":""la mitad del avalúo"",""textoCorrecto"":""dos tercios (2/3) del avalúo (art. 493)"",""explicacion"":""Art. 493 CPC: el mínimo es 2/3, no 1/2.""},{""id"":2,""textoIncorrecto"":""muebles se rematan ante el tribunal"",""textoCorrecto"":""muebles se venden en martillo; inmuebles se rematan ante el tribunal"",""explicacion"":""Art. 482 CPC: muebles = martillero. Art. 488: inmuebles = subasta judicial.""}]",2,"Arts. 482-493 CPC. Postura mínima y forma de realización según tipo de bien.",DERECHO_PROCESAL_CIVIL,LIBRO_III,TITULO_I,De la realización de bienes,2
"La tercería de dominio se tramita como incidente de 3 días. El embargo confiere al ejecutante un derecho exclusivo sobre el bien.","La tercería de dominio se tramita como JUICIO ORDINARIO (art. 521). El embargo NO confiere derecho exclusivo (procede reembargo).","[{""id"":1,""textoIncorrecto"":""como incidente de 3 días"",""textoCorrecto"":""como juicio ordinario en cuaderno separado (art. 521)"",""explicacion"":""Art. 521 CPC: las tercerías de dominio y posesión son juicio ordinario. Las de prelación y pago son incidentales.""},{""id"":2,""textoIncorrecto"":""derecho exclusivo"",""textoCorrecto"":""no confiere exclusividad; procede reembargo"",""explicacion"":""El embargo no da preferencia. Los mismos bienes pueden embargarse en otros juicios.""}]",2,"Arts. 521 CPC. Tramitación de tercerías y naturaleza no exclusiva del embargo.",DERECHO_PROCESAL_CIVIL,LIBRO_III,TITULO_I,De las tercerías,2
"La tercería de pago busca ser pagado ANTES que el ejecutante. La sustitución del embargo permite al ejecutante reemplazar los bienes.","La tercería de pago busca concurrir A PRORRATA (art. 518). La sustitución es derecho del EJECUTADO, no del ejecutante (art. 457).","[{""id"":1,""textoIncorrecto"":""pagado ANTES que el ejecutante"",""textoCorrecto"":""concurrir a prorrata con el ejecutante"",""explicacion"":""Art. 518 CPC: la de prelación busca ser pagado antes. La de pago busca concurrir en igualdad (a prorrata).""},{""id"":2,""textoIncorrecto"":""permite al ejecutante reemplazar"",""textoCorrecto"":""permite al ejecutado reemplazar bienes por dinero"",""explicacion"":""Art. 457 CPC: la sustitución es derecho del deudor ejecutado, no del acreedor.""}]",2,"Arts. 457 y 518 CPC. Tercería de pago vs. prelación y titularidad de la sustitución.",DERECHO_PROCESAL_CIVIL,LIBRO_III,TITULO_I,De las tercerías,2
"Para el remate de inmuebles se publican 2 avisos con 5 días de anticipación. El notario firma la escritura como representante del ejecutado.","Se publican 4 avisos con 15 DÍAS entre el último y el remate (art. 489). El JUEZ firma la escritura (art. 497).","[{""id"":1,""textoIncorrecto"":""2 avisos con 5 días"",""textoCorrecto"":""4 avisos con al menos 15 días entre el último y el remate"",""explicacion"":""Art. 489 CPC: 4 publicaciones + 15 días de plazo.""},{""id"":2,""textoIncorrecto"":""El notario firma"",""textoCorrecto"":""el juez firma la escritura como representante legal del ejecutado"",""explicacion"":""Art. 497 CPC: el juez actúa como vendedor forzoso en nombre del ejecutado.""}]",2,"Arts. 489 y 497 CPC. Publicaciones del remate y representante legal en la escritura.",DERECHO_PROCESAL_CIVIL,LIBRO_III,TITULO_I,De la realización de bienes,2
"La tercería de dominio siempre suspende el remate. El sobrante del producto del remate queda en poder del tribunal indefinidamente.","Solo suspende si hay instrumento público verosímil (art. 523). El sobrante se DEVUELVE al ejecutado.","[{""id"":1,""textoIncorrecto"":""siempre suspende"",""textoCorrecto"":""solo suspende si el tercero acompaña instrumento público o auténtico verosímil"",""explicacion"":""Art. 523 CPC: sin instrumento verosímil, el remate continúa pese a la tercería.""},{""id"":2,""textoIncorrecto"":""queda en poder del tribunal indefinidamente"",""textoCorrecto"":""el sobrante se devuelve al ejecutado"",""explicacion"":""Arts. 510-513 CPC: pagado el acreedor, el remanente es del ejecutado.""}]",2,"Arts. 510-523 CPC. Suspensión condicional del remate y destino del sobrante.",DERECHO_PROCESAL_CIVIL,LIBRO_III,TITULO_I,De las tercerías,2
