textoConBlancos,blancos_json,explicacion,rama,libro,titulo,materia,dificultad
"La CS está compuesta por {1} ministros. De ellos, {2} deben ser abogados externos.","[{""id"":1,""correcta"":""veintiuno"",""opciones"":[""veintiuno"",""quince"",""veinticinco"",""once""]},{""id"":2,""correcta"":""cinco"",""opciones"":[""cinco"",""tres"",""diez"",""siete""]}]","Art. 78 CPR. 21 ministros = 16 de carrera + 5 externos.",DERECHO_ORGANICO,COT,TITULO_III,De la Corte Suprema,1
"La CS funciona en {1} como forma ordinaria. El pleno requiere mínimo {2} ministros.","[{""id"":1,""correcta"":""salas"",""opciones"":[""salas"",""pleno"",""comisiones"",""audiencias""]},{""id"":2,""correcta"":""once"",""opciones"":[""once"",""veintiuno"",""quince"",""siete""]}]","Arts. 95-99 COT. Salas = ordinario. Pleno = 11 mínimo.",DERECHO_ORGANICO,COT,TITULO_III,De la Corte Suprema,2
"En Chile existen {1} Cortes de Apelaciones. Las salas funcionan con mínimo {2} ministros.","[{""id"":1,""correcta"":""diecisiete"",""opciones"":[""diecisiete"",""doce"",""veinte"",""quince""]},{""id"":2,""correcta"":""tres"",""opciones"":[""tres"",""cinco"",""dos"",""cuatro""]}]","Arts. 54 y 67 COT. 17 CA + quórum de 3 por sala.",DERECHO_ORGANICO,COT,TITULO_III,De las Cortes de Apelaciones,1
"El recurso de {1} protege garantías del art. 19 CPR. El recurso de {2} protege la libertad personal.","[{""id"":1,""correcta"":""protección"",""opciones"":[""protección"",""amparo"",""apelación"",""casación""]},{""id"":2,""correcta"":""amparo"",""opciones"":[""amparo"",""protección"",""queja"",""revisión""]}]","Arts. 20 y 21 CPR. Protección = garantías generales. Amparo = libertad personal.",DERECHO_ORGANICO,COT,TITULO_III,De las Cortes de Apelaciones,1
"La {1} reemplaza al juez en tribunal unipersonal. La {2} completa el quórum en tribunal colegiado.","[{""id"":1,""correcta"":""subrogación"",""opciones"":[""subrogación"",""integración"",""suplencia"",""delegación""]},{""id"":2,""correcta"":""integración"",""opciones"":[""integración"",""subrogación"",""coordinación"",""sustitución""]}]","Arts. 211-219 COT. Subrogación = unipersonal. Integración = colegiado.",DERECHO_ORGANICO,COT,TITULO_III,De los tribunales ordinarios,2
"El Presidente de la CS dura {1} años. El presidente de la CA rota {2}.","[{""id"":1,""correcta"":""dos"",""opciones"":[""dos"",""cuatro"",""uno"",""tres""]},{""id"":2,""correcta"":""anualmente"",""opciones"":[""anualmente"",""cada dos años"",""cada cuatro años"",""mensualmente""]}]","Arts. 57 y 93 COT. CS = 2 años elección. CA = rotación anual por antigüedad.",DERECHO_ORGANICO,COT,TITULO_III,De la Corte Suprema,2
"Los alegatos ante la CA duran máximo {1} minutos. La {2} es la exposición previa del relator.","[{""id"":1,""correcta"":""treinta"",""opciones"":[""treinta"",""quince"",""sesenta"",""diez""]},{""id"":2,""correcta"":""relación"",""opciones"":[""relación"",""audiencia"",""vista"",""lectura""]}]","Arts. 223 CPC y 372 COT. 30 min alegatos + relación previa.",DERECHO_ORGANICO,COT,TITULO_III,De las Cortes de Apelaciones,2
