titulo,textoCompleto,rama,libro,titulo_materia,materia,dificultad
"Art. 98 CC — Esponsales","Los esponsales o desposorio, o sea la promesa de matrimonio mutuamente aceptada, es un hecho privado, que las leyes someten enteramente al honor y conciencia del individuo, y que no produce obligación alguna ante la ley civil.",DERECHO_CIVIL,LIBRO_I,TITULO_III,De los esponsales,1
"Art. 102 CC — Definición de matrimonio","El matrimonio es un contrato solemne por el cual un hombre y una mujer se unen actual e indisolublemente, y por toda la vida, con el fin de vivir juntos, de procrear, y de auxiliarse mutuamente.",DERECHO_CIVIL,LIBRO_I,TITULO_IV,Del matrimonio,1
"Art. 131 CC — Deberes entre cónyuges","Los cónyuges están obligados a guardarse fe, a socorrerse y ayudarse mutuamente en todas las circunstancias de la vida. El marido y la mujer se deben respeto y protección recíprocos.",DERECHO_CIVIL,LIBRO_I,TITULO_IV,Del matrimonio,1
"Art. 42 Ley 19.947 — Terminación del matrimonio","El matrimonio termina por la muerte de uno de los cónyuges; por la muerte presunta, cumplidos que sean los plazos señalados en el artículo siguiente; por sentencia firme de nulidad, y por sentencia firme de divorcio.",DERECHO_CIVIL,LIBRO_I,TITULO_IV,Del matrimonio,1
"Art. 61 Ley 19.947 — Compensación económica","Si, como consecuencia de haberse dedicado al cuidado de los hijos o a las labores propias del hogar común, uno de los cónyuges no pudo desarrollar una actividad remunerada o lucrativa durante el matrimonio, o lo hizo en menor medida de lo que podía y quería, tendrá derecho a que, cuando se produzca el divorcio o se declare la nulidad del matrimonio, se le compense el menoscabo económico sufrido por esta causa.",DERECHO_CIVIL,LIBRO_I,TITULO_V,De la separación de los cónyuges,2
