titulo,columnaIzqLabel,columnaDerLabel,pares_json,explicacion,rama,libro,titulo_materia,materia,dificultad
"Tribunales ordinarios: composición y función","Tribunal","Composición y función principal","[{""id"":1,""izquierda"":""Corte Suprema"",""derecha"":""21 ministros. Jurisdicción nacional. Casación, queja, revisión, protección 2ª instancia""},{""id"":2,""izquierda"":""Corte de Apelaciones"",""derecha"":""Variable (4-31 ministros). Territorial. Apelaciones, protección 1ª instancia, amparo""},{""id"":3,""izquierda"":""Juzgado de Letras"",""derecha"":""1 juez. Local. Causas civiles, comerciales, minas, actos no contenciosos 1ª instancia""}]","COT. Cuadro esencial de los tres tribunales ordinarios.",DERECHO_ORGANICO,COT,TITULO_III,De los tribunales ordinarios,1
"CS en pleno vs. en sala","Forma","Materias que conoce","[{""id"":1,""izquierda"":""Pleno (mín. 11 de 21)"",""derecha"":""Desafueros, amovilidad de ministros CA, Auto Acordados, facultades disciplinarias/económicas (art. 96)""},{""id"":2,""izquierda"":""Sala (5 ministros)"",""derecha"":""Casación forma y fondo, queja, revisión, apelación de protección/amparo, contiendas (art. 98)""}]","Arts. 96-98 COT. Distinción clave entre pleno y sala de la CS.",DERECHO_ORGANICO,COT,TITULO_III,De la Corte Suprema,2
"Subrogación vs. integración","Concepto","Tribunal / Forma","[{""id"":1,""izquierda"":""Subrogación"",""derecha"":""Tribunal UNIPERSONAL: secretario abogado o juez más cercano reemplaza al juez impedido""},{""id"":2,""izquierda"":""Integración"",""derecha"":""Tribunal COLEGIADO: fiscal judicial o abogado integrante completa el quórum de la sala""}]","Arts. 211-219 COT. Distinción esencial entre ambos mecanismos de reemplazo.",DERECHO_ORGANICO,COT,TITULO_III,De los tribunales ordinarios,2
"Presidencia: CS vs. CA","Tribunal","Sistema de presidencia","[{""id"":1,""izquierda"":""Corte Suprema"",""derecha"":""Elegido por los ministros. 2 años. No reelegible (art. 93 COT)""},{""id"":2,""izquierda"":""Corte de Apelaciones"",""derecha"":""Rota anualmente por orden de antigüedad entre los ministros (art. 57 COT)""}]","Arts. 57 y 93 COT. Dos sistemas distintos de presidencia en tribunales colegiados.",DERECHO_ORGANICO,COT,TITULO_III,De los tribunales ordinarios,2
"Tribunales unipersonales de excepción","Tribunal","Quién lo ejerce y cuándo","[{""id"":1,""izquierda"":""Ministro de CA (art. 50)"",""derecha"":""Causas civiles y criminales con fuero mayor (Presidente, ministros de Estado, diplomáticos)""},{""id"":2,""izquierda"":""Presidente CA Santiago (art. 51)"",""derecha"":""Causas específicas: demandas civiles contra ministros de CS, recursos de amparo""},{""id"":3,""izquierda"":""Ministro de CS (art. 52)"",""derecha"":""Causas de amovilidad, visitas extraordinarias a tribunales""},{""id"":4,""izquierda"":""Presidente de CS (art. 53)"",""derecha"":""Causas de extradición activa, desafueros de funcionarios""}]","Arts. 50-53 COT. Los cuatro tribunales unipersonales de excepción y sus materias.",DERECHO_ORGANICO,COT,TITULO_III,De los tribunales unipersonales de excepción,2
