textoConBlancos,blancos_json,explicacion,rama,libro,titulo,materia,dificultad
"Se deben alimentos: al {1}, a los descendientes, a los {2}, a los hermanos y al donante de donación cuantiosa.","[{""id"":1,""correcta"":""cónyuge"",""opciones"":[""cónyuge"",""conviviente"",""padre"",""tutor""]},{""id"":2,""correcta"":""ascendientes"",""opciones"":[""ascendientes"",""sobrinos"",""tíos"",""cuñados""]}]","Art. 321 CC. Enumeración taxativa de los titulares del derecho de alimentos.",DERECHO_CIVIL,LIBRO_I,TITULO_XVIII,De los alimentos que se deben por ley a ciertas personas,1
"Los alimentos {1} habilitan al alimentado para subsistir modestamente de un modo correspondiente a su {2} social.","[{""id"":1,""correcta"":""congruos"",""opciones"":[""congruos"",""necesarios"",""provisionales"",""legales""]},{""id"":2,""correcta"":""posición"",""opciones"":[""posición"",""clase"",""condición"",""nivel""]}]","Art. 323 CC. Los congruos atienden a la posición social; los necesarios dan solo lo indispensable.",DERECHO_CIVIL,LIBRO_I,TITULO_XVIII,De los alimentos que se deben por ley a ciertas personas,1
"El derecho de pedir alimentos no puede {1} por causa de muerte, ni venderse o cederse de modo alguno, ni {2}.","[{""id"":1,""correcta"":""transmitirse"",""opciones"":[""transmitirse"",""reclamarse"",""ejercerse"",""solicitarse""]},{""id"":2,""correcta"":""renunciarse"",""opciones"":[""renunciarse"",""modificarse"",""suspenderse"",""delegarse""]}]","Art. 334 CC. Triple característica: intransmisible, intransferible e irrenunciable.",DERECHO_CIVIL,LIBRO_I,TITULO_XVIII,De los alimentos que se deben por ley a ciertas personas,1
"Las {1} son cargos impuestos a ciertas personas a favor de aquellos que no pueden {2} a sí mismos o administrar competentemente sus negocios.","[{""id"":1,""correcta"":""guardas"",""opciones"":[""guardas"",""tutorías"",""curatelas"",""representaciones""]},{""id"":2,""correcta"":""dirigirse"",""opciones"":[""dirigirse"",""mantenerse"",""valerse"",""gobernarse""]}]","Art. 338 CC. Definición legal de las guardas (tutelas y curadurías).",DERECHO_CIVIL,LIBRO_I,TITULO_XIX,De las tutelas y curadurías en general,1
"Se llaman {1} las personas jurídicas formadas por una reunión de personas. {2} son las establecidas mediante la afectación de bienes a un fin determinado.","[{""id"":1,""correcta"":""corporaciones"",""opciones"":[""corporaciones"",""sociedades"",""asociaciones"",""cooperativas""]},{""id"":2,""correcta"":""Fundaciones"",""opciones"":[""Fundaciones"",""Instituciones"",""Patrimonios"",""Fideicomisos""]}]","Art. 545 CC. Distinción esencial: corporación = personas; fundación = bienes afectados a un fin.",DERECHO_CIVIL,LIBRO_I,TITULO_XXXIII,De las personas jurídicas,1
"Las personas jurídicas son personas {1}, capaces de ejercer derechos y contraer {2} civiles, y de ser representadas judicial y extrajudicialmente.","[{""id"":1,""correcta"":""ficticias"",""opciones"":[""ficticias"",""abstractas"",""ideales"",""morales""]},{""id"":2,""correcta"":""obligaciones"",""opciones"":[""obligaciones"",""compromisos"",""deberes"",""responsabilidades""]}]","Art. 545 CC. El CC chileno adopta la teoría de la ficción para explicar la persona jurídica.",DERECHO_CIVIL,LIBRO_I,TITULO_XXXIII,De las personas jurídicas,1
"Los alimentos se deben a los hijos hasta que cumplan {1} años, salvo que estén estudiando una profesión u oficio, caso en que se extienden hasta los {2} años.","[{""id"":1,""correcta"":""veintiún"",""opciones"":[""veintiún"",""dieciocho"",""veinticinco"",""veinte""]},{""id"":2,""correcta"":""veintiocho"",""opciones"":[""veintiocho"",""veinticinco"",""treinta"",""veintitrés""]}]","Art. 332 CC. Extensión hasta los 28 años si estudia; sin límite si tiene incapacidad.",DERECHO_CIVIL,LIBRO_I,TITULO_XVIII,De los alimentos que se deben por ley a ciertas personas,1
