titulo,columnaIzqLabel,columnaDerLabel,pares_json,explicacion,rama,libro,titulo_materia,materia,dificultad
"Heredero vs. Legatario","Característica","Heredero / Legatario","[{""id"":1,""izquierda"":""Título de sucesión"",""derecha"":""Heredero: universal | Legatario: singular""},{""id"":2,""izquierda"":""Qué recibe"",""derecha"":""Heredero: todo o cuota del patrimonio | Legatario: bienes determinados""},{""id"":3,""izquierda"":""Responsabilidad por deudas"",""derecha"":""Heredero: responde a prorrata | Legatario: no responde (salvo cargas del legado)""},{""id"":4,""izquierda"":""Posesión legal"",""derecha"":""Heredero: posesión legal desde la apertura | Legatario: debe pedir entrega""}]","Art. 951 CC. La distinción heredero/legatario es fundamental para determinar responsabilidad por deudas.",DERECHO_CIVIL,LIBRO_III,TITULO_I,Definiciones y reglas generales,1
"Órdenes de sucesión intestada y sus integrantes","Orden","Quiénes heredan","[{""id"":1,""izquierda"":""Primer orden"",""derecha"":""Hijos + cónyuge sobreviviente""},{""id"":2,""izquierda"":""Segundo orden"",""derecha"":""Ascendientes + cónyuge sobreviviente""},{""id"":3,""izquierda"":""Tercer orden"",""derecha"":""Hermanos del difunto""},{""id"":4,""izquierda"":""Cuarto orden"",""derecha"":""Colaterales hasta el sexto grado""},{""id"":5,""izquierda"":""Quinto orden"",""derecha"":""El Fisco""}]","Arts. 988-995 CC. El cónyuge solo aparece en los dos primeros órdenes.",DERECHO_CIVIL,LIBRO_III,TITULO_II,Reglas relativas a la sucesión intestada,1
"Apertura, delación y aceptación","Concepto","Momento en que ocurre","[{""id"":1,""izquierda"":""Apertura de la sucesión"",""derecha"":""Al momento de la muerte del causante (art. 955)""},{""id"":2,""izquierda"":""Delación"",""derecha"":""Al momento de la muerte si la asignación es pura y simple; al cumplirse la condición si es condicional (art. 956)""},{""id"":3,""izquierda"":""Aceptación o repudiación"",""derecha"":""Cuando el asignatario manifiesta su voluntad (no tiene plazo fijo, pero puede ser compelido)""}]","Arts. 955-957 CC. Los tres conceptos se suceden cronológicamente pero pueden coincidir.",DERECHO_CIVIL,LIBRO_III,TITULO_I,Definiciones y reglas generales,2
"Representación vs. Transmisión vs. Sustitución","Mecanismo","Cuándo opera","[{""id"":1,""izquierda"":""Representación"",""derecha"":""El representado falta (premuere, es indigno o repudia); solo en sucesión intestada""},{""id"":2,""izquierda"":""Transmisión"",""derecha"":""El asignatario muere después del causante sin haber aceptado ni repudiado; opera en testada e intestada""},{""id"":3,""izquierda"":""Sustitución"",""derecha"":""El testador designa expresamente un reemplazante para el caso de que el asignatario falte; solo en sucesión testada""}]","Arts. 957, 984 y 1156 CC. Tres mecanismos distintos para suplir la falta de un asignatario.",DERECHO_CIVIL,LIBRO_III,TITULO_I,Definiciones y reglas generales,3
"Incapacidad vs. Indignidad para suceder","Característica","Incapacidad / Indignidad","[{""id"":1,""izquierda"":""Efecto"",""derecha"":""Incapacidad: impide adquirir | Indignidad: permite adquirir pero se puede privar""},{""id"":2,""izquierda"":""Forma de operar"",""derecha"":""Incapacidad: de pleno derecho | Indignidad: requiere sentencia judicial""},{""id"":3,""izquierda"":""Ejemplo"",""derecha"":""Incapacidad: inexistencia al momento de la apertura | Indignidad: homicida del causante""},{""id"":4,""izquierda"":""Purga"",""derecha"":""Incapacidad: no se purga | Indignidad: se purga en 5 años de posesión (art. 975)""}]","Arts. 961-972 CC. La incapacidad es más radical; la indignidad es una sanción que requiere declaración.",DERECHO_CIVIL,LIBRO_III,TITULO_I,Definiciones y reglas generales,3
