titulo,textoCompleto,rama,libro,titulo_materia,materia,dificultad
"Art. 1793 CC — Definición de compraventa","La compraventa es un contrato en que una de las partes se obliga a dar una cosa y la otra a pagarla en dinero. Aquella se dice vender y ésta comprar. El dinero que el comprador da por la cosa vendida, se llama precio.",DERECHO_CIVIL,LIBRO_IV,TITULO_XXIII,De la compraventa,1
"Art. 1801 inc. 1 CC — Solemnidad de la compraventa de inmuebles","La venta se reputa perfecta desde que las partes han convenido en la cosa y en el precio; salvas las excepciones siguientes. La venta de los bienes raíces, servidumbres y censos, y la de una sucesión hereditaria, no se reputan perfectas ante la ley, mientras no se ha otorgado escritura pública.",DERECHO_CIVIL,LIBRO_IV,TITULO_XXIII,De la compraventa,1
"Art. 1815 CC — Venta de cosa ajena","La venta de cosa ajena vale, sin perjuicio de los derechos del dueño de la cosa vendida, mientras no se extingan por el lapso de tiempo.",DERECHO_CIVIL,LIBRO_IV,TITULO_XXIII,De la compraventa,1
"Art. 1858 CC — Vicios redhibitorios","Son vicios redhibitorios los que reúnen las calidades siguientes: haber existido al tiempo de la venta; ser tales, que por ellos la cosa vendida no sirva para su uso natural, o solo sirva imperfectamente; no haberlos manifestado el vendedor, y ser tales que el comprador haya podido ignorarlos sin negligencia grave de su parte.",DERECHO_CIVIL,LIBRO_IV,TITULO_XXIII,De la compraventa,2
"Art. 1889 CC — Lesión enorme","El vendedor sufre lesión enorme, cuando el precio que recibe es inferior a la mitad del justo precio de la cosa que vende; y el comprador a su vez sufre lesión enorme, cuando el justo precio de la cosa que compra es inferior a la mitad del precio que paga por ella.",DERECHO_CIVIL,LIBRO_IV,TITULO_XXIII,De la compraventa,2
