textoConBlancos,blancos_json,explicacion,rama,libro,titulo,materia,dificultad
"El que ha cometido un {1} o cuasidelito que ha inferido daño a otro, es obligado a la {2}.","[{""id"":1,""correcta"":""delito"",""opciones"":[""delito"",""contrato"",""acto"",""error""]},{""id"":2,""correcta"":""indemnización"",""opciones"":[""indemnización"",""restitución"",""compensación"",""reparación""]}]","Art. 2314 CC. Delito/cuasidelito + daño = obligación de indemnizar.",DERECHO_CIVIL,LIBRO_IV,TITULO_XXXV,De los delitos y cuasidelitos,1
"Las obligaciones que se contraen sin convención, nacen o de la ley o del hecho {1} de una de las partes. Si el hecho es {2}, constituye un cuasicontrato.","[{""id"":1,""correcta"":""voluntario"",""opciones"":[""voluntario"",""involuntario"",""ilícito"",""doloso""]},{""id"":2,""correcta"":""lícito"",""opciones"":[""lícito"",""ilícito"",""doloso"",""culpable""]}]","Art. 2284 CC. Hecho voluntario + lícito + sin convención = cuasicontrato.",DERECHO_CIVIL,LIBRO_IV,TITULO_XXXIV,De los cuasicontratos,1
"Si un delito o cuasidelito ha sido cometido por dos o más personas, cada una será {1} responsable de todo {2}.","[{""id"":1,""correcta"":""solidariamente"",""opciones"":[""solidariamente"",""subsidiariamente"",""proporcionalmente"",""alternativamente""]},{""id"":2,""correcta"":""perjuicio"",""opciones"":[""perjuicio"",""daño"",""gasto"",""costo""]}]","Art. 2317 CC. Solidaridad legal entre coautores de ilícito civil.",DERECHO_CIVIL,LIBRO_IV,TITULO_XXXV,De los delitos y cuasidelitos,1
"Las acciones ordinarias prescriben en {1} años y las ejecutivas en {2} años.","[{""id"":1,""correcta"":""cinco"",""opciones"":[""cinco"",""diez"",""tres"",""cuatro""]},{""id"":2,""correcta"":""tres"",""opciones"":[""tres"",""cinco"",""uno"",""dos""]}]","Art. 2515 CC. La ejecutiva prescrita subsiste como ordinaria por 2 años más.",DERECHO_CIVIL,LIBRO_IV,TITULO_XLII,De la prescripción,1
"La acción por responsabilidad extracontractual prescribe en {1} años contados desde la {2} del acto.","[{""id"":1,""correcta"":""cuatro"",""opciones"":[""cuatro"",""cinco"",""diez"",""tres""]},{""id"":2,""correcta"":""perpetración"",""opciones"":[""perpetración"",""denuncia"",""sentencia"",""prescripción""]}]","Art. 2332 CC. 4 años desde la perpetración (no desde el conocimiento).",DERECHO_CIVIL,LIBRO_IV,TITULO_XXXV,De los delitos y cuasidelitos,2
"Los honorarios de profesiones liberales prescriben en {1} años. Las prescripciones de corto tiempo no se {2}.","[{""id"":1,""correcta"":""dos"",""opciones"":[""dos"",""tres"",""cinco"",""uno""]},{""id"":2,""correcta"":""suspenden"",""opciones"":[""suspenden"",""interrumpen"",""extinguen"",""renuncian""]}]","Arts. 2521 y 2523 CC. Corto tiempo = 2 años + no se suspende.",DERECHO_CIVIL,LIBRO_IV,TITULO_XLII,De la prescripción,2
"El agente {1} administra sin {2} los negocios de alguna persona y se obliga para con esta.","[{""id"":1,""correcta"":""oficioso"",""opciones"":[""oficioso"",""judicial"",""comercial"",""público""]},{""id"":2,""correcta"":""mandato"",""opciones"":[""mandato"",""contrato"",""autorización"",""permiso""]}]","Art. 2286 CC. Agencia oficiosa = gestión espontánea sin mandato.",DERECHO_CIVIL,LIBRO_IV,TITULO_XXXIV,De los cuasicontratos,1
