textoConBlancos,blancos_json,explicacion,rama,libro,titulo,materia,dificultad
"La compraventa es un contrato en que una de las partes se obliga a {1} una cosa y la otra a pagarla en {2}.","[{""id"":1,""correcta"":""dar"",""opciones"":[""dar"",""prestar"",""entregar"",""ceder""]},{""id"":2,""correcta"":""dinero"",""opciones"":[""dinero"",""especie"",""bienes"",""servicios""]}]","Art. 1793 CC. Dar + dinero = compraventa. Si no hay dinero sino otra cosa = permuta.",DERECHO_CIVIL,LIBRO_IV,TITULO_XXIII,De la compraventa,1
"La venta de los bienes {1} no se reputa perfecta ante la ley mientras no se ha otorgado {2} pública.","[{""id"":1,""correcta"":""raíces"",""opciones"":[""raíces"",""muebles"",""fungibles"",""corporales""]},{""id"":2,""correcta"":""escritura"",""opciones"":[""escritura"",""autorización"",""sentencia"",""inscripción""]}]","Art. 1801 CC. Solemnidad de la compraventa de inmuebles.",DERECHO_CIVIL,LIBRO_IV,TITULO_XXIII,De la compraventa,1
"La venta de cosa {1} vale, sin perjuicio de los derechos del dueño de la cosa vendida, mientras no se extingan por {2}.","[{""id"":1,""correcta"":""ajena"",""opciones"":[""ajena"",""propia"",""futura"",""ilícita""]},{""id"":2,""correcta"":""prescripción"",""opciones"":[""prescripción"",""caducidad"",""renuncia"",""sentencia""]}]","Art. 1815 CC. La venta de cosa ajena es válida.",DERECHO_CIVIL,LIBRO_IV,TITULO_XXIII,De la compraventa,2
"El vendedor es obligado a entregar la cosa vendida, al {1} de la evicción y al saneamiento de los vicios {2}.","[{""id"":1,""correcta"":""saneamiento"",""opciones"":[""saneamiento"",""pago"",""resarcimiento"",""cumplimiento""]},{""id"":2,""correcta"":""redhibitorios"",""opciones"":[""redhibitorios"",""ocultos"",""aparentes"",""menores""]}]","Arts. 1824, 1838, 1857 CC. Tres obligaciones del vendedor.",DERECHO_CIVIL,LIBRO_IV,TITULO_XXIII,De la compraventa,1
"La {1} enorme solo procede en la compraventa de bienes {2}.","[{""id"":1,""correcta"":""lesión"",""opciones"":[""lesión"",""nulidad"",""rescisión"",""resolución""]},{""id"":2,""correcta"":""inmuebles"",""opciones"":[""inmuebles"",""muebles"",""corporales"",""raíces""]}]","Art. 1891 CC. Solo inmuebles; excluye muebles, remates judiciales y minas.",DERECHO_CIVIL,LIBRO_IV,TITULO_XXIII,De la compraventa,1
"El vendedor sufre lesión enorme cuando el precio que recibe es inferior a la {1} del justo {2} de la cosa.","[{""id"":1,""correcta"":""mitad"",""opciones"":[""mitad"",""tercera parte"",""cuarta parte"",""décima parte""]},{""id"":2,""correcta"":""precio"",""opciones"":[""precio"",""valor"",""costo"",""avalúo""]}]","Art. 1889 CC. Precio recibido < 50% del justo precio = lesión para el vendedor.",DERECHO_CIVIL,LIBRO_IV,TITULO_XXIII,De la compraventa,2
"La acción redhibitoria prescribe en {1} meses para muebles y en {2} año(s) para inmuebles.","[{""id"":1,""correcta"":""seis"",""opciones"":[""seis"",""tres"",""doce"",""dos""]},{""id"":2,""correcta"":""un"",""opciones"":[""un"",""dos"",""cinco"",""cuatro""]}]","Art. 1866 CC. Plazos cortos por la naturaleza comercial de la acción.",DERECHO_CIVIL,LIBRO_IV,TITULO_XXIII,De la compraventa,2
