titulo,columnaIzqLabel,columnaDerLabel,pares_json,explicacion,rama,libro,titulo_materia,materia,dificultad
"Impedimentos dirimentes absolutos y su fundamento","Impedimento (art. 5 Ley 19.947)","Fundamento","[{""id"":1,""izquierda"":""Vínculo matrimonial no disuelto"",""derecha"":""Principio de monogamia""},{""id"":2,""izquierda"":""Menor de 16 años"",""derecha"":""Falta de madurez suficiente para el matrimonio""},{""id"":3,""izquierda"":""Privación del uso de razón"",""derecha"":""Imposibilidad de prestar consentimiento válido""},{""id"":4,""izquierda"":""Incapacidad de expresar voluntad"",""derecha"":""Imposibilidad material de manifestar consentimiento""}]","Art. 5 Ley 19.947. Cada impedimento dirimente absoluto protege un valor esencial del matrimonio.",DERECHO_CIVIL,LIBRO_I,TITULO_IV,Del matrimonio,2
"Vicios del consentimiento: patrimonial vs. matrimonial","Vicio","¿En contratos patrimoniales? / ¿En matrimonio?","[{""id"":1,""izquierda"":""Error"",""derecha"":""Vicio en ambos, pero en matrimonio solo error en identidad o cualidades personales determinantes""},{""id"":2,""izquierda"":""Fuerza"",""derecha"":""Vicio en ambos: debe ser injusta, grave y determinante""},{""id"":3,""izquierda"":""Dolo"",""derecha"":""Vicio solo en contratos patrimoniales, NO en matrimonio""},{""id"":4,""izquierda"":""Lesión"",""derecha"":""Vicio en algunos contratos patrimoniales, NO en matrimonio""}]","Art. 8 Ley 19.947 vs arts. 1451-1458 CC. El matrimonio tiene un régimen más restringido de vicios del consentimiento.",DERECHO_CIVIL,LIBRO_I,TITULO_IV,Del matrimonio,2
"Regímenes matrimoniales","Régimen","Características principales","[{""id"":1,""izquierda"":""Sociedad conyugal"",""derecha"":""Régimen supletorio; masa común de bienes administrada por el marido""},{""id"":2,""izquierda"":""Separación total de bienes"",""derecha"":""Cada cónyuge administra y dispone libremente de sus bienes""},{""id"":3,""izquierda"":""Participación en los gananciales"",""derecha"":""Cada uno administra lo suyo durante el matrimonio; al término se compensan las ganancias""}]","Art. 135 CC y Ley 19.947. La sociedad conyugal se aplica por defecto; los otros se pactan.",DERECHO_CIVIL,LIBRO_I,TITULO_IV,Del matrimonio,1
"Separación judicial vs. Divorcio","Institución","Efecto principal","[{""id"":1,""izquierda"":""Separación judicial"",""derecha"":""No disuelve el vínculo; cónyuges siguen casados pero autorizados a vivir separados""},{""id"":2,""izquierda"":""Divorcio"",""derecha"":""Disuelve el vínculo; cónyuges adquieren estado de divorciados y pueden volver a casarse""},{""id"":3,""izquierda"":""Nulidad"",""derecha"":""Se reputa que el matrimonio nunca existió válidamente (efecto retroactivo, salvo putativo)""}]","Ley 19.947. Tres instituciones distintas con efectos muy diferentes sobre el vínculo matrimonial.",DERECHO_CIVIL,LIBRO_I,TITULO_V,De la separación de los cónyuges,1
"Plazos de cese de convivencia para divorcio","Tipo de divorcio","Plazo requerido","[{""id"":1,""izquierda"":""Divorcio-sanción (falta imputable grave)"",""derecha"":""Sin plazo mínimo de cese de convivencia""},{""id"":2,""izquierda"":""Divorcio de común acuerdo"",""derecha"":""Más de 1 año de cese de convivencia""},{""id"":3,""izquierda"":""Divorcio unilateral"",""derecha"":""Al menos 3 años de cese de convivencia""}]","Art. 54 y 55 Ley 19.947. Los plazos aumentan según la gravedad de la causal o la falta de consenso.",DERECHO_CIVIL,LIBRO_I,TITULO_V,De la separación de los cónyuges,1
