titulo,columnaIzqLabel,columnaDerLabel,pares_json,explicacion,rama,libro,titulo_materia,materia,dificultad
"Acción reivindicatoria vs. Acciones posesorias","Característica","Reivindicatoria / Posesorias","[{""id"":1,""izquierda"":""Qué protege"",""derecha"":""Reivindicatoria: dominio | Posesorias: posesión""},{""id"":2,""izquierda"":""Qué debe probar el actor"",""derecha"":""Reivindicatoria: ser dueño | Posesorias: posesión de 1 año""},{""id"":3,""izquierda"":""Sobre qué bienes recae"",""derecha"":""Reivindicatoria: muebles e inmuebles | Posesorias: solo inmuebles""},{""id"":4,""izquierda"":""Prescripción"",""derecha"":""Reivindicatoria: no prescribe como tal | Posesorias: 1 año""}]","Arts. 889 y 916 CC. Distinción fundamental entre protección del dominio y protección de la posesión.",DERECHO_CIVIL,LIBRO_II,TITULO_XIII,De las acciones posesorias,2
"Tipos de mejoras y su régimen de abono","Tipo de mejora","Regla de abono al poseedor vencido","[{""id"":1,""izquierda"":""Necesarias"",""derecha"":""Se abonan siempre, sin importar buena o mala fe (art. 908)""},{""id"":2,""izquierda"":""Útiles"",""derecha"":""Solo se abonan al poseedor de buena fe (art. 909)""},{""id"":3,""izquierda"":""Voluptuarias"",""derecha"":""No se abonan; poseedor de buena fe puede retirar materiales (art. 911)""}]","Arts. 908-911 CC. El sistema protege al dueño pero evita el enriquecimiento injusto respecto de mejoras indispensables.",DERECHO_CIVIL,LIBRO_II,TITULO_XII,De la reivindicación,2
"Querellas posesorias y sus requisitos","Querella","Requisito especial","[{""id"":1,""izquierda"":""Amparo"",""derecha"":""Posesión de 1 año + temor de turbación futura""},{""id"":2,""izquierda"":""Restitución"",""derecha"":""Posesión de 1 año + despojo (con o sin violencia)""},{""id"":3,""izquierda"":""Restablecimiento"",""derecha"":""No requiere posesión de 1 año + despojo VIOLENTO + procede incluso para mero tenedor""}]","Arts. 921-928 CC. Cada querella tiene requisitos distintos. La de restablecimiento es la más amplia en legitimación activa.",DERECHO_CIVIL,LIBRO_II,TITULO_XIII,De las acciones posesorias,2
"Prescripción adquisitiva: ordinaria vs. extraordinaria","Característica","Ordinaria / Extraordinaria","[{""id"":1,""izquierda"":""Posesión requerida"",""derecha"":""Ordinaria: regular | Extraordinaria: cualquiera""},{""id"":2,""izquierda"":""Plazo muebles"",""derecha"":""Ordinaria: 2 años | Extraordinaria: 10 años""},{""id"":3,""izquierda"":""Plazo inmuebles"",""derecha"":""Ordinaria: 5 años | Extraordinaria: 10 años""},{""id"":4,""izquierda"":""Suspensión"",""derecha"":""Ordinaria: sí opera | Extraordinaria: no, salvo entre cónyuges""},{""id"":5,""izquierda"":""Título y buena fe"",""derecha"":""Ordinaria: se exigen | Extraordinaria: se presumen de derecho""}]","Arts. 2508-2511 CC. Cuadro comparativo esencial para el examen de grado.",DERECHO_CIVIL,LIBRO_II,TITULO_XIV,De algunas acciones posesorias especiales,2
"Interrupción vs. Suspensión de la prescripción","Concepto","Efecto","[{""id"":1,""izquierda"":""Interrupción natural"",""derecha"":""Se pierde el tiempo transcurrido; si se recupera la posesión dentro de 1 año, no se pierde""},{""id"":2,""izquierda"":""Interrupción civil"",""derecha"":""Se pierde todo el tiempo transcurrido por demanda judicial del dueño""},{""id"":3,""izquierda"":""Suspensión"",""derecha"":""Se detiene el cómputo pero NO se pierde el tiempo ya corrido; solo opera a favor de ciertas personas""}]","Arts. 2502-2509 CC. La interrupción es más drástica (se pierde tiempo); la suspensión solo pausa el cómputo.",DERECHO_CIVIL,LIBRO_II,TITULO_XIV,De algunas acciones posesorias especiales,2
